Title,Company,Location,Salary,Salary Type,Fit Score,Response Probability,Missing Skills,Verdict,URL
AI Engineer,Oliver Bernard,European Union (Remote),,missing,65,25,"Hands-on experience with LLMs (OpenAI, Anthropic, etc.) | Agent frameworks like LangChain | RAG systems implementation | Conversational AI development | Tool use and function calling | Vector databases | TypeScript",They should apply as a learning opportunity but realistically need to pivot from traditional ML to LLM/conversational AI to be competitive for this role.,https://www.linkedin.com/jobs/view/4392675433/?eBP=CwEAAAGdU_Kqo5ROJYstMpJjMYM3-veCkljHOElRdsPT5v6OskhMZ1IUyEv7IPoLrjuq_x9yK5XhfObSR95_wWwvOF1A661leeS04ZYsOGRBOWacFmmEOka7d4sDmAEXKHSgAGb8vBJ1yVgfV9uVsuVtXb-VF9BdbxO8oIOYan-cqddXAqLfrFbLaCusMSScCsX8OZmDPMeuQYuCwgk9SNpl3o2IOhxYSj-KKbpzyUdf02Tw5ESgB6QIfveYtifS3qU2NnM-jskSjDBDnVTazDkTFeb8MwDmScnKVjuqCJxYFOxEKIU-21PL0sbQBCz15otQtWGMXdRP4W95NErm_PemWNAkENL_Zhsynj-sJc0FxkSFpcPYtoSjVhmpU-C80JzxT4a26Lv0qBQLC8I-bZXw_j2Ys5N-KB0Ls7V4C95Hii_Hrdc-VBxffcYY1kBqyLShfGJEN9fRXOHcvqCssFNjOZ6zH6RS5xUYxPrpqzwSoXnDu_vzli-VTZSPERK7gRWPFw8VNw&refId=vS1PDguKwI4C5fFrvaP%2FEw%3D%3D&trackingId=dw1S8LKQKVThWQUsU5FagA%3D%3D&trk=flagship3_search_srp_jobs
Senior ML Engineer,Coltech,European Union (Remote),,missing,65,25,5+ years MLOps experience (has ~2-3 years) | 5+ years total ML experience (has ~4 years) | Kubernetes experience | CI/CD pipeline implementation | Airflow or similar orchestration tools | Kubeflow experience | Large-scale production system maintenance,Apply despite experience gaps - your strong technical foundation and demonstrated production impact could differentiate you from other applicants if positioned strategically.,https://www.linkedin.com/jobs/view/4395651589/?eBP=CwEAAAGdU_Kqo85vfZy-K5UGFkN7rbC2vJTD0Wp_nDzOK1g1y5SBQ2UFllqFSv2ukVjjT2HhyY3ed-LOYiDkmGfmkrhoD594cMEzmsbuALKExX2YG4KdeBwzAIjOO8dXgTNoKlha0D9t6RZ0MQkjZylRK3cb0TICmqpcXZqtdZQYvEN6I2Ggkm0Nf4umA3XEfJ7R8gT9lsFuzai896IRWk20wyKHimQc7jvMKs-FPXtMGTlW9_Jnkz8en1VBUbvkSSUqDSwFysLRDwx_EAxuZfSvjrr11QP2dW2M-HFLvFsCR1BEittZRKnN1VBaVT7lftm_aZqMDfR5Xxd38jGZWPJujmsTaxEILy8b3_v1GfTAWXe-nalT8fNWYUV892M1TXm42iG0dCIA4mmSR0LCiHRsgGDfQ-ajIOMyPEMUzzziml1nAI_Ip9bBBRxrWcxUPgxFXxC01eVS7BwGMDrtBzmQb50s25g4URg4CrUVjzZCoE4zXTk&refId=vS1PDguKwI4C5fFrvaP%2FEw%3D%3D&trackingId=v8B%2FSqhuwuGiQmfxc6Ny%2BA%3D%3D&trk=flagship3_search_srp_jobs
Senior Machine Learning Engineer,Shopfully,European Union (Remote),,missing,65,45,NLP and Generative AI experience | Computer Vision architectures like YOLO | Multi-modal language models | Recommendation systems experience | Text classification/NER/caption generation projects | Image classification/understanding projects | Search systems (OpenSearch/ElasticSearch) | Production experience with 100k+ predictions per day | Retail/e-commerce domain knowledge,"Apply with reservations - your ML engineering fundamentals are strong, but you'll need to convincingly demonstrate transferable skills to retail AI applications during the interview process.",https://www.linkedin.com/jobs/view/4358253837/?eBP=CwEAAAGdU_Kqoy4uaxJu3S984ygN8bj4ERtNBJKTf5NV3FdPw_GK1fMyT_0C8zYjHKWn0pxM5yDo_gU-_-xNhYZjRMbWmck5bEGdUd2yLfFh2eNDijJ9nkqy5yA2YUITaHXZTGoZRza5P6xYkg138hD6dflV9QkalLfsAhyD8LgCt-KPTXnvMxhwGdeDAhN9a5zI0KDtJqlgaGz6UReeduEGBktfYnZGPbRVw0-bJy3RNlDtHX4QeF2rU5RMFeBjIL3E48wDVRt9lsG3OR07XEFoBcsWGqvoT0sTtqWt1YqnVfEQ3suu-GoVdlNw4kIyYLz2ez_0rDuzbdzh0Q6MOVpGaXukmUxpEzygbpmV6evFXKJZqVyzMmtDltvEvjexGGgByyMPscPmcjOA2HndRaaBCzi67LRerEqBLXAcXjq5DykG4xjtnWOcAElB3lyXGctZDrP74DCnRLD-nSTSr1yZGz4GLECnW1R_WFg-9w4sZyfjDH69Mdmh&refId=vS1PDguKwI4C5fFrvaP%2FEw%3D%3D&trackingId=R3UO3tJnNhVSBpJc0i9zCA%3D%3D&trk=flagship3_search_srp_jobs
Senior Machine Learning Engineer,Halon,European Union (Remote),,missing,65,35,NLP and transformer models experience | LLM fine-tuning and productionization | Email security domain knowledge | Kubernetes deployment | Model drift monitoring in production | Business-focused ML applications | CI/CD for ML systems | Imbalanced dataset handling at scale,"Apply if genuinely interested in transitioning to commercial NLP/security ML, but expect tough competition given the domain mismatch and 513 applicants including many with direct email security experience.",https://www.linkedin.com/jobs/view/4379919802/?eBP=CwEAAAGdU_KqpOv-UX00wglZgqJFQTllwAczCDcRG_8qa-qKiPY88ePWwhtnan8cbFcU8Vvk8XFVZ5L6mpNanoZRsMYAdG-ugR67AbZGOBU5mBvCv4NolidSVNDOd9G-Mmm2-qTV2Dzu9L1Pv66UovPmmPNxGW_bX_gJmywP8pUdkCdYO2Fe2rTFWRk1HIpz1OrpJZTLcEG7yhWr1zGBChmOREG_NJLxerCFBoqkuO1yoLW3P0Tlrp7PkWYhgLSM5airnPLQ4WjN5u3GSs2VMVDITxw_KPJ3t_1NXL14bldousU70jA4ZndqjjoU35ETyxDgHq3key9EWgNMEbiahP4CsHu-3YvqZgwMkVab4QKm3IcvKFKQB44Z0V7Iion0oUorcKW8msEwfOYt1XsXsBOPj7NJfVt27hZWD90Z3mu_BGWfxgG5NIrGqxLOEhnVJwchIUKmSfkuI-Ualj0MFrcK1wACCNpRfjl53zKC9gjEiENl9BuoETXxm8OZ-crrNnENth0&refId=vS1PDguKwI4C5fFrvaP%2FEw%3D%3D&trackingId=fHkciso7TyUjJs%2FgqxAx6w%3D%3D&trk=flagship3_search_srp_jobs
Senior AI/ML Engineer,Proxify,EMEA (Remote),,missing,65,25,"Natural Language Processing or Recommendation Systems experience | Large Language Models (GPT-4, Llama 3) implementation | Agentic workflows and RAG systems | Vector databases | SQL-aware AI agents | LLM fine-tuning | Cost optimization for LLMs | Context window management","Apply cautiously - while you have solid ML engineering fundamentals, you'll need to quickly demonstrate familiarity with modern LLM/RAG architectures that dominate this role.",https://www.linkedin.com/jobs/view/4369741774/?eBP=NOT_ELIGIBLE_FOR_CHARGING&refId=nqFcEen7o2swW1OErM9KdQ%3D%3D&trackingId=EmnHhw2FKpcGCR60Fh4Uyw%3D%3D&trk=flagship3_search_srp_jobs
Senior AI-Engineer (all genders) [Wien],adesso Austria GmbH,"Vienna, Austria (Hybrid)",,missing,65,25,German fluency (only A2 level) | Cloud development (AWS/Azure) | LLM and GraphRAG experience | Vector database embeddings | Consulting/client advisory experience | Product Owner/Requirements Engineer experience | EU AI regulation knowledge,"Apply with realistic expectations - strong technical foundation but significant gaps in consulting experience, German fluency, and modern LLM technologies make this a stretch role.",https://www.linkedin.com/jobs/view/4292360214/?eBP=CwEAAAGdU_MDFFk939VW5VRM_TfBj93tcK2ncjdSoVT1UpU6m8fom9rpxhhvL2D91PituWTBblOeetwUXOK9a2h1YX5TihS8pHFMJkr7vPOom1pnUl7iH6M77rObJe1wnl9So2xE8UQcBHmnQmPHtqeQsfTe56h50UJ8dRbjCwINxrpSbLz9qW3UnELV5w5FB6AbBbZM2a_JvcGB8-B-PALDWJzXoBp4H4h6oa551vqDzMXhktnUcEo3DiWBu2oMKC7tnRQgXy7MCfhFe4Jts7VEwxzJzR07R5SDRBlnFznXaJGPAv7c24z7qCn67UmKRamI3Nmf7PWqHryYWmSuuMr38yASLu82zyK9FEWUvYGgyuyi5OZZJzjFe6YQSY0HHHuxkiYHxfwI-tf2cA-gZT70_BkPP0bn207LwXMCsesoCnASbrfn7wsKhgOKL6eCd2frlR4dXLmCirviDGGXOP7wosTRkIormgmnS7xBsAIS40U4&refId=lG5A2iKhnvhuL%2FhB8XOHvA%3D%3D&trackingId=3ayZZ4iBuftiEk3xvTOUmA%3D%3D&trk=flagship3_search_srp_jobs
AI Engineer - up to €130k - Fully Remote,Oliver Bernard,European Union (Remote),,missing,65,25,"LLM experience (GPT, Claude, etc.) | RAG systems | Agent frameworks (LangChain) | Vector databases | Embedding pipelines | Prompt engineering | Function calling/tool use | Production LLM deployment",Apply strategically - your engineering skills are solid but you'll need to quickly demonstrate LLM knowledge through projects or highlight any hidden generative AI experience.,https://www.linkedin.com/jobs/view/4395641721/?eBP=BUDGET_EXHAUSTED_JOB&refId=lG5A2iKhnvhuL%2FhB8XOHvA%3D%3D&trackingId=bj7%2FQz5SUJPBG34AGiQQNQ%3D%3D&trk=flagship3_search_srp_jobs
AI Software Engineer,Wave Group,European Union (Remote),,missing,65,25,AWS experience (no mention in resume) | LLM/agent systems production experience | Distributed systems architecture at scale | Backend engineering focus | Enterprise software development | 5+ years Python requirement not clearly met,"Apply despite gaps - the ML expertise is strong and the company may value research depth, but expect tough competition from backend-focused engineers with AWS experience.",https://www.linkedin.com/jobs/view/4395164229/?eBP=BUDGET_EXHAUSTED_JOB&refId=Gc6RHTlDOfVoJHUdasQbsA%3D%3D&trackingId=I47d1pGVPV7SECPX4hHohA%3D%3D&trk=flagship3_search_srp_jobs
Lead Consultant AI & Cloud Development (w/m/x) in Innsbruck/Graz/Wien,NTT DATA Europe & Latam,"Vienna, Vienna, Austria",,missing,45,25,"Cloud platforms (AWS, Azure, GCP) | DevOps practices and tools | Security implementation | Team leadership and management | Client consulting experience | Stakeholder management | Business development and sales | Agile methodology leadership | Enterprise software development | Make-or-buy decision experience | Offshore team management | High-availability system architecture",Should not apply - this is a senior consulting role requiring enterprise leadership experience that the candidate's research-focused background doesn't demonstrate.,https://www.linkedin.com/jobs/view/4381736812/?eBP=CwEAAAGdU_K0PkOjG3jKAY1OpOpVGA5tIDeVmn0DBoWjSzMe5w_CFhRcCo5N-XyoUPDJUDE-fmPAVZZxHcZwGvJRanQX7IVDtWVelMmi2RZRAAQw4E6kNZKnUhm89iTR3QcO9tBKHOaGfFqXAshvwbkSImG3lOIoaTHofSaF_Ocu6NwtWirVnt_qTb6lbbfFsaYGeFG6fs0ONEl4iZQd4HRMxW4zn3KBV2s4XbM5K55-oYM9B50Qq8SVdpwHAZ12QMd2YjmhTYdXi3I2vi5Pa4c2XYi5WjPntJydfnux4fGil7v-C9XsjruJTdP7yhDbqZS3-FzubVtct3yMd_4PRGX4g30M3wCVNignEgsuIaUw75Cwwd_x0BYlRrzK0K4vs0E_MvTzwtYULLt4QW4lMfEpQ4XPy0jWURzg5vuYln6sSvvoDGBPRIkfAiW2FDSbC1_ffZBvC9v5tTmKOGXWLnSj-1MAWpbAkOY2IeFjavH2wQ&refId=nqFcEen7o2swW1OErM9KdQ%3D%3D&trackingId=bqHwAAh%2BIsPLW7GesY8i%2BA%3D%3D&trk=flagship3_search_srp_jobs
Software Architect AI (all genders) [Wien],adesso Austria GmbH,"Vienna, Austria (Hybrid)",,missing,45,25,German language proficiency (job requires 'sehr gute Deutsch') | Cloud architecture experience (AWS/Azure) | AI solution architecture for enterprise clients | Consulting/client-facing experience | Business development and proposal writing | Microsoft Azure specific knowledge | R programming language | Enterprise AI implementation experience,Should not apply due to missing German language requirement and lack of consulting/enterprise architecture experience that this senior role demands.,https://www.linkedin.com/jobs/view/4292359390/?eBP=CwEAAAGdU_NKtB8AQK4MYw87bpPLVilNK36wC0HuwpBhHMQBWbIoM-JiCDWXpZ3wKwReVZgRd1lSbRPnWQrELi7HNYIUn4T4asX2oyMizTOjyVczmJlqyXy9sYlnHPW_WY9WMbQvUawrmG8RNrtxJIzAvhYHTZnKUY0ZPe4ma0g4Gk0lkK6y7neIf0r__gNTl_fn_sn6Qg9lSL8bpJsSEpKV-sOElxa_HY2OdeGZZN_KQtPrIsHThfxqRJXgT43IBRL913-wYCK1xij8DkCH3UL54DrMNrNC-uE92GkF2oSwO-dTonRR2EqfyNR2WQ-TbxQYgdbQf1w2oeuuuN4w9Txs_4isyLwb5_OwRbDI8ivZpgk7rVm81fOnlXKz_78NTnfyv29Zi6_coOGbeVT5y4EjuUdM2lRURTDAd_oO6rXz1kztZy-uRzR2zOlPAUW7YVxv7URjpLwUEC-KorZ7g4GaHeb5_IYZjuy4ev5nbcs_tA&refId=hcgJroqeW4FcQtTBhln28w%3D%3D&trackingId=1Jma9Hj0HyKEWjce8Ac3bA%3D%3D&trk=flagship3_search_srp_jobs
mySugr Digital Biomarker Data Scientist (m/f/d),Roche,"Vienna, Vienna, Austria",,missing,45,25,7+ years data science experience (has 4+ years) | Digital biomarker domain expertise | Healthcare/medical device industry experience | AWS cloud platform experience | Regulatory knowledge (MDR/FDA) | Leadership of data science teams | Diabetes technology exposure | PySpark for big data processing,Should not apply - the 3-year experience gap and complete lack of healthcare domain knowledge make this a poor fit for a senior medical device role requiring regulatory expertise.,https://www.linkedin.com/jobs/view/4383754791/?eBP=CwEAAAGdU_XfPkPAsWwoJCxnkQve-d1iIfpEz6S5N-oz_J78uT92h8si14x3I15mV3I6AhD3EEyJc65J1aFJF6rl7jWJJQwW_YCwGSUYHIJxqIuNlud8cUyg1r_V7cgI0bFlhpOYCrDQrQJtZGfLVgUHTmn3l_GVWQEsmABc6oPS1sY7MEeqnJygXPS2HJaEE_DZw-WANAX2mVr_8iOpy984fDFN9VqZVzG_1U9F3PwVosczZ_wFZb1B1TxbdTOhCjsQOB_awinLjg7sDIdqPmQtHkKeoFgwX1MhGo4wmIp785cvAYs9qjSwVzfmuDCoPdm9oJNwmUgvRc-YeSVybfno_-_cW1AdQ5O_99uHl9oDcrkAauS-jxqe-J3E6qdtoksl0r1QOI93fWPtojl-nC_P5R0z7461eOXeKffO8pRza9602FXHieCc6KUVeaoXydGBs0XdzZxfnFAtqghXiehm_zjyjWjIK4TTwE2cKs5i_QA1&refId=W%2BWWHmxCCKtxuYWCiznb9g%3D%3D&trackingId=K9DzPAc4AD232UKY%2FMuhww%3D%3D&trk=flagship3_search_srp_jobs
Senior Consultant (all genders) Data Integration & AI,Deloitte,"Vienna, Vienna, Austria",,missing,45,25,Finance/Controlling domain knowledge | Data integration platforms (ETL/ELT tools) | Process automation/RPA tools | Low/no-code platforms | Cloud services experience | LLM and Agentic AI solutions | SQL-heavy data engineering | Client consulting experience | German language proficiency | Team leadership experience,"They should not apply for this specific role as it requires finance domain expertise and enterprise consulting skills they lack, but should look for pure AI/ML engineer positions instead.",https://www.linkedin.com/jobs/view/4364520477/?eBP=CwEAAAGdU_iHylc_RfkeNcURznVwtJTVaJFUlf8k2ddk0kZhean-CstCt_VlChKvv-BuDPrq5fStVtl5CAp2I1l6yrlrIE0WtBmNMkTT89WEYcrJY-LnskxF_jtXfGUQ1-ayb9fNPV2ciSOmtIJ_Rc_ECEdQB8g9Gbfa8Oe9FzdMt_PsTiLEVNALK01cwq6SBwaxeX-NzQFcsqOS2hrerAsm18WiJ3GYkRVmU3qFMKfMLGcQaSy4-4iHb_-zRukOSIoZeKP3RI93Rc3096OAwF1FZVSoRZhZZYi2eVcbLbrKfIMksV_C9Jv6SE6LSb50k1NGLmp7OxooDIG5C9bSGWpkL5VSi_UUTIIM9GkZ_0O6xbaTcGHscnRFiBgX_fwgdd9cUCUCIbY50zhKVNjiEZAwmVVC55dt5SpcghchL9mb3yR909C37njuwa_tSXhxLuY3N63Ugc0iDJEBtDBkiSOamXR4DIkjW8cQiUWCsFETBsWe&refId=jqUgpShcE7ztEQdlv6gqeA%3D%3D&trackingId=983ADn0eN3un%2BIXpsqyseQ%3D%3D&trk=flagship3_search_srp_jobs
Join the TTTECH Talent Pool,TTTECH,"Vienna, Vienna, Austria (On-site)",,missing,45,25,Deterministic Networking | Time-Sensitive Networking (TSN) | Time-Triggered Ethernet (TTEthernet) | Safety-Critical Systems | Industrial IoT | Automotive Systems | Aerospace Engineering Applications | Real-time Systems | Network Protocols | Hardware Integration,"Apply cautiously as this appears to be a networking/embedded systems talent pool rather than ML-focused roles, but the aerospace background and Vienna location could create opportunities.",https://www.linkedin.com/jobs/view/4393944818/?eBP=CwEAAAGdU_rNhp9tEnyeKnsu6KYuWzyUoQtlabZgMS2S0q6AKnWpRQCv0-eQkyOtdpjJUIpzSmNXOWn_6jfYZy_1AZ28SpQOYMZOLKUwK56tvvrIe2Mspa9TQtVF4g56xriiahykFVqUn2tndrvgBgA80iiXWd8m8lLProUYuVA-l3JPTBsHzaCgLzdNx0pn-EPS-w-1QJv3CHBmJ4mbvmnOhqMzN8k-WqHKnVNcIi6fDrB1xDphDYe9m4HdG5j9LEjguHK868Qo5NFpU8R0UnIIKJRcwSRqwwPe0d9EFB7X5A_gNujVnvSyL6vH3zEuqls6Djbqnp938X0GSonBN36t0O6kCUYzZUGV9D12PocKOFYgYFJ938TRDrq8lc0YrrvZKhQWGmK5mCNiK0kvBfNta2TQAcSS1E_8sldQS4cQPPWE2Iga-vD8A3Ki_dlLPQBeIaLp7iljBBHTTJ8BSHtIBAfLv7SXvhtr0qqdgMKGzQ&refId=3s3Js01rrpzrWIFasOO7%2Fg%3D%3D&trackingId=7kFDDYU3XzzWN1XMvLVRAQ%3D%3D&trk=flagship3_search_srp_jobs
Teamlead Data Analytics (f/m/x) in Allergy Diagnostics,MADx – Macro Array Diagnostics GmbH,"Vienna, Vienna, Austria (Remote)",,missing,45,25,Team leadership in corporate environment | Dashboard development (Power BI) | Cloud technologies | R or Scala | SQL database proficiency | ETL/ELT processes | Airflow orchestration | Healthcare/diagnostics domain experience,"Apply with caution - significant skills gap in data engineering and BI tools, but Vienna location and some pipeline experience provide a foundation to build on.",https://www.linkedin.com/jobs/view/4392878849/?eBP=NOT_ELIGIBLE_FOR_CHARGING&refId=pJ6HazpMUd2UGvPaPh196A%3D%3D&trackingId=hPQf2TsOXXUQjysabwytIA%3D%3D&trk=flagship3_search_srp_jobs
Artificial Intelligence Engineer,Zoolatech,European Union (Remote),,missing,35,15,LLM/GPT API integration | Anthropic Claude API experience | Prompt engineering for classification | Production LLM system ownership | JSON schema validation with Pydantic | Token budgeting and context window management | LLM evaluation frameworks | Structured output prompting,"Should not apply - this role requires specific LLM production experience that the candidate lacks, despite strong general ML engineering skills.",https://www.linkedin.com/jobs/view/4395053923/?eBP=CwEAAAGdU_VOfTaOZXC-_Bks5lfRqqHM-bF8m_NH1b7Fq9PO-pEbEJIO6csnHUUkTwp-DpnARGBE0VTnoQ_DYhL1kTIAi06O8gYo7z9bukSz_AkaZMVFJi-Fi3_c1SaNJBy9rn0oAl7fnGTdfXxMdIiG8R2phv2bu_0IMwK1ycfm4i0pDZuLpH0efCv11ICTMKiH9TTa4kw7z2CkQkR5r_Gd_ZJ0GMQOjpMDzvTfAW8WmUkrWmKUFjHa_kb3QFhbcBrrp12AbR4qYrim-pOA9qP0Knio8oFsa4BaAHzoMbA3oZ69tIaLKtZBUbkMzMtcDtpfy5vF3KmV1SxOC1y_dHPTAQluPBFGd5L1pIvay2A0NKzpjbi6O_0s13HqEnOfq4YQHSX_gHMXh-VjOmv_CSumN-xuT7wWfyNdd0btNiCYmpLuFNfeVSGm-_-MHBNeEBbXMOjupFE4bkxMmKhRLFZDFB8QRAYrKXmbjcjYulXoMShu9wh_fPzGEiSPwPa-inEfezNJdw&refId=VnNZ%2FdnegQ6VKdFN7PCg0w%3D%3D&trackingId=XKA24z3ZjWgnsnAPoni%2BNQ%3D%3D&trk=flagship3_search_srp_jobs
AI Architect (m/w/d),Capgemini,"Vienna, Vienna, Austria (Remote)",,missing,35,15,Enterprise/Solution Architecture experience | Cloud hyperscaler expertise (Azure/AWS/GCP) | DevOps/CI/CD pipeline implementation | Legacy system modernization | Microservices architecture | German language proficiency | Client-facing consulting experience | IT infrastructure and networking | Cross-functional team leadership,You should not apply as this role requires senior enterprise architecture experience and cloud expertise that your research-focused ML background doesn't demonstrate.,https://www.linkedin.com/jobs/view/4382958076/?eBP=CwEAAAGdU_WYfIMZTaUruX-L0CW19k43liTy7tiaTP4833Kvxq_TOga7eRgVDvQR3tKyEq3zHGlucSAG2HoRsDNvvlKnzgi3_KvVt5U6-mk9LvXwY3Qg2ZNHBSvxqQrc3V7bXqIoazgk9epPnJgPlCzivc4X400JgXOZJUkhOl8JSLcsmVQPAfWGqKgaqiirt3JKy3baxe6h7bf6vliV397xvIE7m76J_KrFyWcefmS6Z7H082eq5Enph4JCnU2N1fbH7m-AlEaAhp-566-jaX1WRZ-VP9wXlMUCaT_fdW7wo6EsVWBLVZJkIJDCzReDG0qJ5yE-Zwt_HEfAdDQ8_OFLDtC2MDlhXEdNxt4PErMOo9UCdjigj5QS6b7_CfPU8EEP9VIEF6yzqkSQ6HYuDcAc3iH_K8XrXlYfsetlZp1eYjhBcifBabaZW5HJIs0J6neVD-mzNUGgWYR67GZa8vbVKPOUAhb1gwwd1JbC-Eo1sw&refId=mUDzFaoeWVfVGrf8pW6PZw%3D%3D&trackingId=ft%2Fnah4ryqfAfW90nWNF4g%3D%3D&trk=flagship3_search_srp_jobs
Senior Software Engineer,Sportradar,"Vienna, Vienna, Austria (On-site)",,missing,35,25,CI/CD pipelines expertise | AWS cloud services | Database management (relational and non-relational) | Flask web framework | OpenAPI/gRPC specifications | Large project management from conception to maturity | Software engineering focus over research,"Apply with realistic expectations - location match is perfect and ML knowledge is strong, but significant gaps in core software engineering requirements make this a reach position.",https://www.linkedin.com/jobs/view/4396474431/?eBP=NOT_ELIGIBLE_FOR_CHARGING&refId=67CHOtFOtnQw9EEUjYewgQ%3D%3D&trackingId=0Z%2FV5GS7OPFV9MZL1StLgA%3D%3D&trk=flagship3_search_srp_jobs
Lead Data Engineer (all genders) [Wien],adesso Austria GmbH,"Vienna, Austria (Hybrid)",,missing,25,15,Azure Cloud ecosystem | Data Warehouse and Data Lake architecture | Databricks platform | Azure Synapse | pySpark | Data integration and ETL tools | MDM (Master Data Management) | Infrastructure as Code (IaC) | CI/CD pipelines | Azure DevOps | Client consulting experience | Team leadership experience | German language skills,"Should not apply - this is a senior cloud data engineering consultant role requiring Azure expertise and client leadership, while candidate is a junior-to-mid level ML research engineer with academic background.",https://www.linkedin.com/jobs/view/3866805015/?eBP=CwEAAAGdU_K0Pum30KHRc5vkCSHUI7mIC98lJKXSHfkRYgvripGqB-RbtTQSby-FxW5fuuUx4FQenfLk2kl6qLq8uLaX7r9RWvGj2q-I4QyEO-o-RUecnUuEitL-wnz6FoR797394O1KVY1izBIJ6bUuzFNz7dV9R7pU5gJb0lE4oUVnqDaC_THI_4RtFsPWJ6D62r69WQe__XvRBFHPcZG1ZCs_oaTER9gLKMNo7uha8AzJSEhYWywieIAD-Tt7N8Nr8Gn5fdp-dcLfSuhfTAMl9AJUaCSDrePd8KnNToo9W7rDKJq5HkR1uCN2VrhnHFhONcdM5igG-sMSe4nM2Yv6NT95-4wdtLSIm3upLMTR7SHFQs9YQHYd7rzVYFPXB89kELfYDTzxV4Y-SoGY_9I549CijNB5NqUsi7xyEkF5wNHzMGIH8TarIJTfYy8UWLpAifsLtSd2OcpEuasxcR4xa1GZI7IXlCk7az_Z3zo&refId=nqFcEen7o2swW1OErM9KdQ%3D%3D&trackingId=s39tDtXATUk68xVBFqmn%2Fw%3D%3D&trk=flagship3_search_srp_jobs
TypeScript & AI Developer – Vienna,Teachino,"Vienna, Austria (Hybrid)",,missing,25,15,TypeScript (primary language requirement) | Vue 3 frontend framework | NestJS backend framework | PostgreSQL database | LangGraph/LangChain AI frameworks | Langfuse and Agenta tools | Kubernetes orchestration | Full-stack web development | Educational technology domain experience,"Should not apply - this is a TypeScript web developer role with AI components, not an AI researcher role with some web development.",https://www.linkedin.com/jobs/view/4395037161/?eBP=BUDGET_EXHAUSTED_JOB&refId=nqFcEen7o2swW1OErM9KdQ%3D%3D&trackingId=GDgHQDOhqIpL7Sen8v3CEw%3D%3D&trk=flagship3_search_srp_jobs
Senior Data Engineer Azure (all genders) [Wien],adesso Austria GmbH,"Vienna, Austria (Hybrid)",,missing,25,15,"Azure cloud platform experience | Azure Synapse, Azure Data Factory, Microsoft Fabric | Azure DevOps CI/CD pipelines | Infrastructure as Code (Terraform, Ansible, Puppet) | Scala or Java development | Cloud strategies (IaaS, PaaS, SaaS) | Analytics platform development | Business intelligence systems",Should not apply - this is a significant career pivot from ML research to enterprise data engineering that requires substantial Azure cloud platform expertise the candidate currently lacks.,https://www.linkedin.com/jobs/view/4292353560/?eBP=CwEAAAGdU_OGjP7OEal1BQ67xZ_kigZ24biYwEtH-jVc1XgePhOOBE71Rmse8hYUpQXj83CgXJPm05DL1TdAsmz7FI3zt4dkFVI41s6YNRa63fRjqfEUkzPWIBQ7_lX3mbApuM1oM_dFl6MVsBlAyEm6IuS4riAJW9cO4Y_d9QXrlZn9GxddmcfNMj6S8JxAIrdZQrWhxsdXUzA416gBwwBDhqQoJoZvCPXe5wtrbrYRlxIyE9fkJ-BRY2TOVF6MZCk0PFDnJo9eGk2zQ7unqFXM1q6ak3R6Q2pncQNs7kB3uOCJBrpU39Of-wujhBkBw_u61XAJk3RLD04jYzsd7Hp7OG9ZcUqzHjBmpCcIui96hQYPlR9kUXYZKFT0p6YXoB4GDwTMaHYRJVhtwAOYcBOdPa0Rwazj-a_HcPYYJ7UUbsxHr4W_ZY0xru4i3z0aG1SDoPytgta0YbS_um0II7uOAjjb04jN_Ey6BrxZvpg&refId=DM48ZqdnngiwxTT45GFaqA%3D%3D&trackingId=ZHER%2BkGrL8NUXYhG6Yplsg%3D%3D&trk=flagship3_search_srp_jobs
Mid-Level AI Data Analyst,Ruby Labs,European Union (Remote),,missing,25,15,"Mixpanel experience | Product analytics experience | User behavior analysis | Product KPIs (activation, retention, engagement, conversion) | A/B testing frameworks | GA4/Amplitude experience | BI tools (Tableau, Looker) | Commercial product experience","Should not apply - this is a product analytics role requiring commercial experience with user behavior and business metrics, while candidate has only academic ML research background.",https://www.linkedin.com/jobs/view/4392998520/?eBP=NOT_ELIGIBLE_FOR_CHARGING&refId=1mQtISncZOzwX6R1NPN6iQ%3D%3D&trackingId=BwnPJQkHL0UJO1Pp%2FOo0sA%3D%3D&trk=flagship3_search_srp_jobs
Machine Learning Engineering Manager - Evaluations,Canva,"Innere Stadt, Vienna, Austria (Hybrid)",,missing,25,5,"Team leadership/management experience | Generative models (Diffusion, GANs, VAEs, LLMs) | Visual quality assessment and aesthetic modeling | Design principles knowledge | Production scaling at enterprise level | Human preference learning | Safety monitoring and red-teaming",Should not apply - this is a senior management role requiring significant leadership experience and generative AI expertise that the candidate currently lacks.,https://www.linkedin.com/jobs/view/4374118790/?eBP=CwEAAAGdU_VWhzhxsSzxEn5pC6zVF21gq4KvjaiOQcr_56ZtRaR9PPXJFfcx0OMb1sCb27iWetvO5RPgQg-PvuEpQFUoCbIg7Z0Uhir7DUnFtYdWFb74fzIDJTRMFln64sa56U8ozG5Pi7jacEUoNqUPS4iYqkw7MGw6F2gPbzAwcmHp6NTkIfloN96qV_BI6JXwXCQc-B3Lr1iHKtOfm00WBYMvFLeTnlEdR4gXQkzMilCyQQeBxRg1Ur2TVGY2z7X-Owu-jmTk5boudAVTC24jS3R_J8synXoR9_hJ9mWgsKY1u2y5NVhHBcfK94hjppmqdHmBGBw885wnP45nW3uRiVDs2YwlriGxxZul-SYfK8je4kFVaO1znGN4d5rscgQlHFf5iymC6hnjZ6YrZNJT3sz3TPAc3PV9_kS-LhJAP0iTukKThP3Hfn8YKiOj3rMToMEZRlSvOFUHKjpPY1M7HdVEAr7tUA0ASNWud-pNlhyt&refId=1mQtISncZOzwX6R1NPN6iQ%3D%3D&trackingId=so32KvfSecapUvWo%2FdfMIg%3D%3D&trk=flagship3_search_srp_jobs
Quant Researcher,Selby Jennings,"Vienna, Vienna, Austria",,missing,25,15,"Derivatives experience (options, volatility, structured products) | Market microstructure understanding | Financial markets knowledge | Greeks and options pricing | Order-book data experience | Trading strategy development | Backtesting financial strategies","Should not apply - this is a finance-heavy quant role requiring derivatives expertise that the candidate completely lacks, despite strong ML foundations.",https://www.linkedin.com/jobs/view/4392915102/?eBP=CwEAAAGdU_VWh55H8kOfk0tQp5BaQCZT-pW0rXXWp3e47bKPC8PLyiDEilFxuYscwc2Pxp6YkaEVlS7LUUH1R7ZviT7GNz4WVTD0vbcOJs4zoqyCcOvvIFuBl2FBLnwy_w_qgrEsrFQ643GfZ73quFd8JqZ16vwcoCWwgSC6agWjuKbKXeqvkbreSQiyrfP9si6IsV_7zP-TY6hRc9gIH1O1Ts-P7rTb0NExNBnd8FshwJWxeCl3tenkMFU-JU9HuYmwh4bJXWx1qdxmwgRnBLdfAOrmdAtHw6k1N5sl1kdckCq6C1FWJkI8hQ4-NXSDEvoWWe6r078T_mFq390PJP4ovtocl5d4YgBpKeE_OgoiIGF1wYXXe6fn4OpG7x4uKD-aDCbbSh-Ja9bG3fcjJ4spakhUmsDcploVHY2xBlvrdYKlO48nDMzstSNd1oxuAZJuT_sOqadoaw07XIiDv-XNrwyIAYXKvcdyYkK5URhS-ubE6QHYc9lT-4Kse7XdB8gdZkM&refId=1mQtISncZOzwX6R1NPN6iQ%3D%3D&trackingId=esIdWc5Wktizu28oX8FQtg%3D%3D&trk=flagship3_search_srp_jobs
Lecturer/Researcher für Medical Engineering and Integrated Healthcare (m/w/d),FH Technikum Wien,"Vienna, Vienna, Austria (Hybrid)",,missing,25,15,German language proficiency for teaching | Medical/biomedical engineering education | Healthcare/clinical industry experience | University teaching experience | Medical device regulations (MDR/IVDR) | Hospital/medical technology knowledge | eHealth/digital health experience,Don't apply - this medical engineering teaching role requires domain expertise and German fluency that your neuroscience/aerospace background doesn't provide.,https://www.linkedin.com/jobs/view/4381956555/?eBP=CwEAAAGdU_WYfIrOukeHFGZvbK5L0iJycztkhXsR4VduRNx-Kqkeh0NQP6WFFvC4lcsErj45E43YlYllObIYSvdDKgdpUIHStIUhPLFekrK2SX6qHbpz9xa85h3KuyjosaGf8d08gTAVunJxt_CmOv2c7sFq7738y7gPOs50FqmDFFK2Xdvp-2XyiIY57GPaCbhokbIYDMCiYNLvPzv3SXb3OA-W7bja6HOLznKLdtI5dvCbHSTdG8s8tFt-Eafeytksjc6tvU3_v6AfHuoRyOeW8edkN5eyV1u4IEAfzHawOCoW705AsyL1cnMPIeoEq8QHDrNQYVPdUH-r_3SWk0MXxIstDx1TpSWz3QcNT1WbR3RvO4msX43dLmqOoh4E1iXYbfe38QFy9FMe82Q_6bi-3bE327UdzFTi7ImB5pauMLrQxLwwmNHLHeCRSMCW4RmHu6PRsemPRkC4rsanEXUMmiVKmHfNZFUZHRE0Zu1oeA&refId=mUDzFaoeWVfVGrf8pW6PZw%3D%3D&trackingId=vE1VoEChBTYUFYb037RQtw%3D%3D&trk=flagship3_search_srp_jobs
