Title,Company,Location,Salary,Salary Type,Fit Score,Response Probability,Missing Skills,Verdict,URL
Senior Software Quality Engineer (m/w/d),Wüstenrot Gruppe,"Vienna, Vienna, Austria (Hybrid)",,missing,15,5,Software Quality Engineer experience | Quality assurance processes and standards | Test automation frameworks | Agile QA methodologies | Database design knowledge | Architecture and design patterns | German language skills for Austrian market | Financial services domain experience,Do not apply - this is a fundamental career pivot from ML research to software QA that requires completely different skills and experience.,https://www.linkedin.com/jobs/view/4326335915/?eBP=CwEAAAGdU_PJoGw2AXDUCpm3hKq_YZX-vTgw5kv272m3C4_Gf8ozWkD4FSCL6NGGsBpvkLd_CHn-GWdkRRgIZDOJUieyW5Fo1NSBDcEF6edSzzkDRVy5hh9C6u1BIfg8gNeRaSR-QWtFnM6fEmC2oQmlmBjUzEQKT-ZnG374mcMhec0inaoVRSAMR_SQqMVp1Old5v3HSHY-7-LuccFO4wh_FJJAOJqkVTje-S1A98D2Y3YuXQUb36CJ1UcAsBMsKV0OV5qMyHBcvnM6tnlXwQqF3sS2dQqkkWtcIh97_tLNyVXTVYsziAKP7YuX2JyaUluNF3_q2EXHnsUjH5AyvKTr5ls62yoCP--qu1x_IfDkMN_kbIqyY7ZO3dNMBF_qODym_9e3I2qVL8sw0SohCgkFJF75PIaQpQFmU7POQeK2jdQa4_R36pwb5xBTkIr79iuhhJhUKtXI4hFzpqfIFg2EFl6lHcW5oo6fhE12dAY&refId=U3n1YjxCdjqWpAmnwUn%2FXA%3D%3D&trackingId=u90TG8JsshtaGnMLsTkhkw%3D%3D&trk=flagship3_search_srp_jobs
Trainee System Test Engineer (all genders) - DE,Frequentis,"Vienna, Austria (Hybrid)",,missing,15,5,Windows systems administration | VoIP technologies | Network administration | System testing methodologies | Integration/regression testing | German language skills | Hardware/embedded systems | Telecommunications systems | Quality assurance processes,Do not apply - this is a complete career pivot from senior ML research to entry-level telecom system testing with no relevant experience overlap.,https://www.linkedin.com/jobs/view/4392598760/?eBP=CwEAAAGdU_PJoC38w4Ophi07q-WR1UjdvNNyHECc9dXxILTHQ_Hpjfk11mb7eqLqtWT37Uiiwu1bREeWDuNlkAGUXAwaoGrZQ2ZoPHGCvLPx9IFe8wsdxkc5rMukv-LywNPyWgkThC3re6FNx9G7Oz48CcVBujmoADjepQR7RK5A5VtkkvMsbcX7UfDdgDYplq5C2DluPuQ-uEETs9jlLM5jP9frGBoKeH1w-v0dis49CazKiZn5H_e0GLla40EEOVkksbpt9FGg42OojJGaU3waXNsD8KxLPY0M4i85y5mJofMUW29Chypsoi_Wo-kQiGSsup8yGDVdjOngLVHMw19OwacqSn2zYSPSngpRkrJi2iS3xmrmMkMkcF_EERFd7E2MG7BJGTAGcOauPDaA7FmOB2L3F7MvycXWtGLCmpziNs6MRP75DdAPzh-TmtJxxR-8W69zckiYNwskAdV6Pgc9Sn4Un5ZAfUIetxFpUOmFUQ&refId=U3n1YjxCdjqWpAmnwUn%2FXA%3D%3D&trackingId=d8qk3mY2q5BHuXXefTfSaA%3D%3D&trk=flagship3_search_srp_jobs
Senior Software Engineer - K8s Operator (m/f/x),Dynatrace,"Vienna, Vienna, Austria (Hybrid)",,missing,15,5,5+ years Golang experience | Kubernetes expertise | Kubernetes Operators knowledge | Object-oriented programming in systems context | Cloud-native development experience | Software engineering in production environments,"Do not apply - this role requires senior-level Golang and Kubernetes expertise that the candidate completely lacks, making this a fundamental skills mismatch.",https://www.linkedin.com/jobs/view/4382126716/?eBP=CwEAAAGdU_PJoHny8KrIHCwrP9uSvRPe_wK2oxg-_s6EDCiH3KRe21-f5JI4BQseKeZfBbAPe_3o1b3m5o2OyvhCXm1rz0xcpYIi5nLhA5MWfQrQlYVNiScKoTBzpHwnzj7mHVbbkBiBwie4mrGZaObJZEusugyQ7-mUiz4a42Hbjw1cQI1WzV9xBQ34fp_CcpI28MuEhxI2_BVV2180mAWFJ5Nz2b7ALjCFPP-DwvuevUikES7oqeO255hLVR0IbM0uo8ymnQxWlknjLF-Sf9hLYauP0oGGd9S2zG-Ena6n1kHcx1UfZG3poUBbWC5PDBv1xrUAJtBxiYwGdTusGwYrkuzicdfgejq27PhJ6F-TYbwUxyBOwicVzAeGLzW9WaAz1wlePMvAEfp5w1fpncQzKXUJnUFfNAuWYOrALAW5g8DYT8cX_2fJ_ApyFguXUXdgOlWd6edFjvjBm77TG3tEFOeUVDvaCCwPiijAJKY&refId=U3n1YjxCdjqWpAmnwUn%2FXA%3D%3D&trackingId=ILsHqhmA33H9UwOYeMI6PQ%3D%3D&trk=flagship3_search_srp_jobs
(Junior) System Engineer – Hochverfügbare IT-Lösungen für Helden des Alltags! (all genders) - DE,Frequentis,"Vienna, Austria (Hybrid)",,missing,15,5,"Windows Server administration | Network technology (Routing, Switching, Firewalls) | Virtualization (VMware) | VoIP technologies | IP communication systems | System integration experience | Cisco technologies | Installation and configuration of enterprise systems | German language skills | System Engineer role experience",Should not apply - this is a complete career pivot from ML research to IT infrastructure with no relevant system engineering experience demonstrated.,https://www.linkedin.com/jobs/view/4370977661/?eBP=CwEAAAGdU_P-rkMCWvnDJg5tj7Xn5Jn3SODJ68A3cQ16q_XtbIO357F0A51M18vQvPxjktDtq54K3j6Amn4k7wJ5D_8IRoFmP6f06PSgX0p8v365JPrm6lhSaFnbWTqumqKnvw-KgKe7eoRs9zbJtqpnGtc_Qnz4rmOd1d1_Re-WE4-QFLHnLXqZMjo3GmML25iItdBd_nVMY1JxVcgAIUq_ww3eXbPWJcH2zpGe3ICQY72cJpjDFA_R0fQscegOFfY4EWt0Y2Xd0gbuc4zJ46mgUkwSsr4YxU2BYPTqB8RN96n8_ZngAf-B3BJ6oUH5I8eFf7j7ufMMeT-1mTJCkNo9xxdIFbVbm7HC02zhG2qHTNxJwLvCsJQL8TwgBw3dUehpGiMtsh8mL9bPvg-o0vwFebuSg5bPR8TpGxCu3xQKucRLulMZ6WQu7MQSgcHFPnVYl0AQ_D58gsRIZTq_9cSzO13UelFiwWASK_UagbK8VQlbJtk&refId=oQYP%2Bp3ys37h4BFQTIKLHA%3D%3D&trackingId=yqHEoyF61uvgV8lqbUuE%2Bg%3D%3D&trk=flagship3_search_srp_jobs
Fullstack Developer (all genders) [Wien],adesso Austria GmbH,"Vienna, Austria (Hybrid)",,missing,15,5,Java | Spring Framework | JPA | JavaScript | TypeScript | Angular | Test Driven Development | Web application development | Frontend development | Backend web services,Do not apply - this is a complete skill mismatch between ML research background and fullstack web development requirements.,https://www.linkedin.com/jobs/view/4370388749/?eBP=CwEAAAGdU_P-rpvoTVh8L2k8PIR7LYDCmLQp8edXSyyxb5hDVMtzPijClps8awC8lpuAZxxdsd5ofaOwoKXtuFET8OIUarqbF-19UbyXe6CSNxl_F7eu1gcYSmx5irrPha-DZvPsdxxpYU3LiSCE_VsDggE--Jnp--U9hPIImfy964Ebm9sW5j-yCOGSSybl7SL2_XfaoY5iSTQvh0-ph-HnV4up8N4bssiT87-NI20Ij3Lic41rNG2hXVZgc3PIi9BfULdzAMMogllyx-rrMBs1p-0CzOCiieGADeep9geoeL5rCNKkB4H3uw6R-Ac3TrbB5p6vKS2VFHj8X7IpeJ2kH29hS9G3RdOe57Nh9euhrFL8fAsstg-Yi16tZ-_6Og0xgPAqE7Ovg-20cGZIyROhC2CLHiHpZa7-eHhpLGvLXRGdC1lbveI4HTzC3vRecBbeP6zLpLnVs0iBR0Hx2RcaWVL3_Z-IdAF_4H6E522ZBGns3bs&refId=oQYP%2Bp3ys37h4BFQTIKLHA%3D%3D&trackingId=dEHUEo%2BABNIUVdEsVOtrOg%3D%3D&trk=flagship3_search_srp_jobs
Web Full Stack Developer - Intranet Platform & Inhouse Apps (m/w/x),REWE International AG,"Vienna, Vienna, Austria (On-site)",,missing,15,5,.NET framework | Java | JavaScript/TypeScript | HTML/CSS | Frontend frameworks | REST services development | SQL/Oracle databases | Web application development | Agile methodologies (Scrum/Kanban) | Windows Server/IIS | CI/CD pipelines | German language proficiency,"Do not apply - this role requires a completely different skill set focused on web development rather than ML research, and the candidate lacks nearly all required technologies.",https://www.linkedin.com/jobs/view/4394616863/?eBP=CwEAAAGdU_P-rhcZ79SmRBWTkIHR3GIy45RHqYoKSeJtOR_LsWKaQaLQVJqfKEvG2aLjh33VPr2mSajU0MpmXwfR5ld3MItJNLLyhWjJoB5sYGiaAd9kv1z6U7FnHODQie1tYPlhQHokV7W_t6IR0N98fXM2G4UmkasrIOUwh2C8i7g7C4z6G8Ilxh6fAa7vF6zwb05GnzHduCmiezr-UniEDix4Lz0TDFzk4GcBNe4qvI_wONIhidiuismncZquWWkOzsdk1p4NtndaXt6M0LzWwtcwM3Gj2-GoIrgKOhGL_kR1Pii0wRK77rn-Lm8iLO_0ufSDkicQDScRLTdwiDPzezBeVy36uA71kb16lNfVYNlP-dN9dAJfGF1R2FRWovTk5nuba_K5-fsSL_5uqWipsIYRgU2K5Ub-fJmnOLyEl_DaDYVy-FE-d52nYTumTTQRhWCw57QYGeF7&refId=oQYP%2Bp3ys37h4BFQTIKLHA%3D%3D&trackingId=OFOjBflpydLK%2FlkcCIZ%2FQA%3D%3D&trk=flagship3_search_srp_jobs
Senior Backend Engineer,Journi,"Vienna, Vienna, Austria (Hybrid)",,missing,15,5,7+ years backend development experience | JVM languages (Scala/Java/Kotlin) | AWS Cloud Services | NoSQL databases | Unit testing frameworks | Backend application architecture | Production backend systems experience,Do not apply - this is a complete role mismatch requiring backend engineering expertise you haven't demonstrated.,https://www.linkedin.com/jobs/view/4378819987/?eBP=NOT_ELIGIBLE_FOR_CHARGING&refId=HGJ8MFn5eLlVoxUKQrqIOw%3D%3D&trackingId=udOk%2BfGL%2FTbHkr7hDecRFw%3D%3D&trk=flagship3_search_srp_jobs
Fullstack Developer (f/m/x),IBM,"Vienna, Vienna, Austria (Hybrid)",,missing,15,5,"Java/JEE/Spring framework | JavaScript/TypeScript | Angular or React | HTML5/CSS3 | SQL and NoSQL databases | Kubernetes/OpenShift | Azure cloud platform | CI/CD pipelines | API management tools (APIGEE, API Connect) | German language proficiency | 5-6 years fullstack development experience",Do not apply - this is a complete career pivot from ML research to fullstack web development with zero overlap in required technologies and missing essential German language skills.,https://www.linkedin.com/jobs/view/4382067459/?eBP=CwEAAAGdU_SRdJcxHAMXjP-sPQOZREf-QYcDDIjsxL1Q5IKAgsFsjCXb_eLjtXsOCK7-YqQTyoGRK7hDmFYjL1JBy1rSgJ1S5Xny-QlDF3PeDLx_m3v6WjemnJmATFUZOVGkcVMkzbGO9Ae-Cp6YHyhrRhqd2XV_DWNZ98fwoGLFG0YfBJLU8r11EfgRISeiODBm7cpNLi1PgMDnGeaKSFKbVA_q6Y-4Go8X8HtBzeR4Grt2LTdqooM2epLiJG1DGtYa7g6jjsP9FqMg9ZU_jC68VkGytb-C8BTfIX2-0dNbDKa_4IU7kMo9Ipc84G-bHqgcEmiJui6CdGLktuFYSROiChOhEjG50nvIsj416diQ4z5u1GzNmU81N4daDUO7BvUTpDIr00lkmPcBY-Zt8zgbAxdYVMYGIAJQOUGfUt-JqEvH0z0GhUm6dwEYizppmKR2zKwW_nb0GW_TBZDeKPRP4b1Hte82W1Q8YRx0cGy9Gj3F&refId=vAjElaIGnQ8SKJ%2BFTR5WCA%3D%3D&trackingId=z%2Fpo6%2Bpg4wTHWC3qdDY7eQ%3D%3D&trk=flagship3_search_srp_jobs
Product Engineer MarTech Tools (m/w/d) TZ ab 30 Std./Wo.,SPAR ICS - Information & Communication Services,"Vienna, Vienna, Austria (Hybrid)",,missing,15,5,MarTech products experience | Digital Asset Management systems | Marketing technologies | Interface management in marketing context | German language skills | Digital marketing domain knowledge | Product management experience | Retail/e-commerce experience,Do not apply - this is a complete domain mismatch requiring MarTech expertise that the candidate entirely lacks.,https://www.linkedin.com/jobs/view/4373355880/?eBP=CwEAAAGdU_XfPuo_KVwxaCEL6Lwq4JUNLxiwt6vlvlnTaANqLw05fGIXenHSlOaRz6V2RfT0LS6eKt2QcCNRTBvvw0sGO1bj-SZ5B7jZjc7WXRr0_KZj8V87B-G4OMXaHlX1VTIdZHfudBnrheHZ_53BwcvU6SWaPh97q90oneZNMef3g5yZeD1F5ZPEnWiUwWCj4xq17w2rH3KEgr3GBpixqYbbvvhSj--p_PwLrvoMerQw66s5pyz3qSwy-473-RgZRYoicwNf3HaO5Z4w2QDEhW_EQimPr7OKwLRpEUK08su5PGg_-eUKu8e5i54z-NHVY0uuZlmhZfEaKGHum9QcRTAN4MZalShFlGU7wwtuMAKa_rqTJW5geHput_JNOMMvqDrZYhBf8LBybh_y6akY3JU-2CLGdrk3t6yFgPqa41BE2kIatMkZu0vg8fedAUywjTZAWJrM9wWEXqru83WJhzY6aphcGeKcrM0FLNWcMg&refId=W%2BWWHmxCCKtxuYWCiznb9g%3D%3D&trackingId=CNJHqdAerfsAj6N7ZMJ7BQ%3D%3D&trk=flagship3_search_srp_jobs
Head of Game Design 707Games (w/m/x),NOVOMATIC,"Gumpoldskirchen, Lower Austria, Austria (On-site)",,missing,15,5,Game design experience | Gambling/casino industry knowledge | Commercial game development | Leadership of game design teams | Market analysis and trend identification | Product specification and compliance experience | Cross-functional team management | Stakeholder presentation experience | Understanding of regulatory frameworks in gaming,"Do not apply - this role requires 10+ years of game design leadership experience in commercial gaming, while your background is purely in academic ML research.",https://www.linkedin.com/jobs/view/4323287280/?eBP=CwEAAAGdU_YbdE8phnrq0ZKPkuzBoFK2DPcQ1SEmTKx82EfmxvcVjOHyDmDMuu8uncO3tjYT3bcCRhk77oPSJqixBZ9iOiTfE__Fj7wxCWfkj47OwIaw4p8zsk1lsAbJpox_XefW1Fm9YWRu57oThaLUyOs87AhOlXPMAyNzztfutEedT85eTJpJqOTKDwqZtateDfXEGJDGtw-xdUxCsVrx83kv6lLoaEtvpA97QacWabxGLPaqbum5feKY0raQ5fSjDF1RXVIyNzbFMNNjlOzoAnKtlPU7CLf9aEFos-aE-iJkWchjtdALnITF-Ee6vCy45cbP5fA7-qHL4i8dcALvDPv12j8eILhrUUJPABRULwmt9vs4LlpHggp9P0Hi7lrnT40tncVQ0sfS8N3u7Iqokva7sB9ld-NaM_-yLpfU1Qjv2v_m4ImATmI0xpNs6jKSgFjH&refId=JOD7%2Bx8rDyBzz%2BJtqmk03Q%3D%3D&trackingId=%2BnmKQM65pq8NtY2r%2FpC48A%3D%3D&trk=flagship3_search_srp_jobs
Product Owner (People Product),Revolut,Austria (Remote),,missing,15,5,5+ years product management experience | HR/performance/recruitment tool domain experience | People management experience | SaaS and B2B product expertise | Business strategy and ROI-based prioritization | Product Owner role experience,"Do not apply - this is a senior product management role requiring business strategy and HR domain expertise, while your background is purely technical research engineering.",https://www.linkedin.com/jobs/view/4329569732/?eBP=CwEAAAGdU_acWKZaSCdGhDI2XglLVVcclMiPjazNSqGuXfvA-uWnXHR4EOCByoVBRWphTfYo8DZh-3HYCRQtT-6Q0mhoQjsckqwHEePvrdB_q5BL2Y-yGdEKxaFe9kQsL4DYz03DAHKyYblNdA4AglQc1-dTbO894gkclbNwMv4juxliM999kNO0PYj-dOXKFFkJCx62h2kSMiTK-imQQ8FzrpDx_ubXuCVLPuEDkAHIzMb1va6cIvYlXdGJ5FWTh_Oo5Jpaf8vgZA26ZkaFKG8tIQZDAF0yOhvpF_VbrIERBDUJBC7XKfr99godV79KtU0FHInfAc42itvDjHKQbLc79tXbOKaMK2m2sZtE9GoSiIVgaoLoHl521Ci2gYbpEB1JcP2eTTDGgCMcJ1B0JDJ2K1ERCzdZu4Ud0vRYYp_TiBDFQ96j7MQqZ1IqXZrXCzEGM0FEW47AA_sS1OW14obgjCz2bHZkAiNWwSbZ2m0RXLrm&refId=2W2oS5QbQB3qQZF5wRnaRg%3D%3D&trackingId=CVtkU24MN97saP3hCejI8w%3D%3D&trk=flagship3_search_srp_jobs
Head Engineering - GreenTech Scale Up,Wohnio,"Vienna, Vienna, Austria (On-site)",,missing,15,5,"AWS (IoT Core, Lambda, ECS) | IoT protocols (MQTT, Modbus, M-Bus) | Node.js backend development | InfluxDB/MongoDB/PostgreSQL | Raspberry Pi | Engineering team management | Production IoT system architecture | Edge computing experience",Should not apply - this is a senior IoT engineering leadership role requiring completely different technical stack and industry experience than the candidate possesses.,https://www.linkedin.com/jobs/view/4396273790/?eBP=NOT_ELIGIBLE_FOR_CHARGING&refId=KhkQm0TyAfBPvrM0IGiu%2BQ%3D%3D&trackingId=ohe%2BE%2F8%2BAYk29w6u%2Bq8TtQ%3D%3D&trk=flagship3_search_srp_jobs
"Customer Engineering Strategy and Operations Lead, EMEA (Fixed-Term Contract)",Google,"Vienna, Vienna, Austria (On-site)",,missing,15,5,6 years management consulting/sales operations/business strategy experience | Management consulting background | Business operations experience | Sales operations experience | Corporate advisory experience | Business strategy development | Process improvement in business context | Looker proficiency | Business planning and execution | Resource planning | Headcount management | Business reviews leadership,"Do not apply - this is a business operations role requiring management consulting experience, not a technical ML engineering position.",https://www.linkedin.com/jobs/view/4381977284/?eBP=CwEAAAGdU_co1YUB-b_fe9Bwf_Tmqsxk2iDQr17j0hdYjYh1jhc5zhvdPcdCCDHjC63G3k89vGnH19TvcNuGgdDakS8UWYthJ8DHH3C1XW9TfVEOkxgB5bfVmBfZz63LjUDUYA71G6hOlH5CU5cxfbEIfOBHX8SPWc131yrRzcXjrPa1xwAz1_140GbK9S_yGHnJUCKPIyWX9avxDx1s6xhxqXVjZ7K4tT9IGTBvVDegb-78QwjCL0h0QdQtYaEhT6jXVa9GPvK2RwW4Vulw3sMCTQCR3iyBHNXxlHKkxpCYCP4hOeYi3PamCFdkxdceW8GU3bETnNMjDuWK4avz5ff5IV6K3KJsr0UUmXvZdBCFl71atgrVscC4uzhoPdgjC8jtmLN8VEgRdoGL9b_BO4N9Skx9nSe3ojKabnFTy2kQx9XLnG25OHVHIltY5tafUIIwkj4_oqyjrwcWk5GmFJIudUbDtAEbr71dp8MizmaIsFm9&refId=KhkQm0TyAfBPvrM0IGiu%2BQ%3D%3D&trackingId=C45wfzqE%2BvvoG8wRXXFK3w%3D%3D&trk=flagship3_search_srp_jobs
Team Lead - Museums,Fever,"Vienna, Vienna, Austria (Hybrid)",,missing,15,5,5+ years museums/cultural institutions/live entertainment industry experience | Commercial/partnerships/business development roles | High-value relationship management with museums | Ticketing platforms and revenue optimization experience | Sales and pipeline management | German C2 level proficiency | CRM systems (Salesforce) experience | Museum and attractions landscape knowledge,Do not apply - this is a complete career pivot into business development/partnerships in the cultural sector with no relevant industry experience or transferable commercial skills.,https://www.linkedin.com/jobs/view/4349601290/?eBP=CwEAAAGdU_dpZjllMTfJK4lOkYIcvXVfc3QDr7KWm0s6NjwNiS4FWQ_kxe-OT0koOQLe1dpwDuMNQl7qUWISJAGC1xRKC36GA50nFMrNLbdLGZmuDpkHTRYVGFNo4Xc77z01IRKhVxCYKO_NTkuBeRM4f2Y90x-maM9ykwSUZCT83kHwhLZoGMWcxOYaHk2CjTHMLumkWQoJm6BAEEAJzA3rhrCBpTsaFndKe0hNlghPyutCw2LNYq6_4-3YZlGXBO9_fVqX_AkgK13VGflLLWVlEibjvhGkw3Y62cPvIiz2YumNXccrADnz6S2gMni4JCilOM1w9YBB3mHZWvE6CTadQ_9znskf9Bj3V6q0G9zTLgBLEC06N_lw-dtB9mB7cNaOotB6RMXIXO660mN6rr1ViEfsS3D_HhCh0BwnRPwzJlC7i-75CFD7s6unkHRiZk8TfdCpYQMd5LO2bPqMXasSOhTECED7ZLCjq6DMkMpz71Yuz_URRg&refId=6KPLhCALssfi84iau8GsPg%3D%3D&trackingId=%2B1530uK8OzIHkr0JDeZi5Q%3D%3D&trk=flagship3_search_srp_jobs
Business Analyst,BrothersTech,European Union (Remote),,missing,15,5,Business Analysis fundamentals | SDLC knowledge | Agile/Scrum methodologies | MS Office proficiency | Business Requirements Documents (BRDs) | User Stories creation | Process mapping | Stakeholder management | User Acceptance Testing (UAT) | Project documentation | GDPR knowledge | Jira/Confluence tools,"Should not apply - this is a complete career change from specialized ML engineering to junior business analysis with no transferable BA experience, making it extremely unlikely to get consideration against 201 applicants with relevant backgrounds.",https://www.linkedin.com/jobs/view/4397568141/?eBP=CwEAAAGdU_dpZmnqYg6sxQbkwOzjIdFyjEdqmGJGSTT-9AegRtKkbAmJekZWms_6GJ_b9Wt6M1YsNIKVgELnc4oGNKR05q1OXKsUY4vy1ZVrnx3YBnTAV9ZhaFDv2SKEif9s7KfqbeIP-A2ybDg96R4wiGuS_i6j6OWqXNIkDcmPp4aFonQNnGgc3Y9XXgDOJ-wsRHwWqHmPnoIv1czQNGjCKSecF4-BYdHrnUfl_3SSOEVHHdFNWOzOL_pQZkb8iiJ3mU1HwbbXdNtU9MoH7pYW8kC0srKrXJZvPCAxQ13PGviGc8dulwILtxu9jac5b7NFTN94qpPyGxQ7wTi2ni5AVz3DSffHivqOSxJxfr0PiDuJfX9U0XC0BIJ2-cDqNu5hlF8DBgqWAmRbbvaOp9EhenhO-9TzRcJyK3DdsROo3H_ukNCY_PwWJ335xKXEo4JFPwAVVni4brJH_PlqOE-aLgiXRQDC1APEZTZoq_i0onzQH5kREf_nT-BJ7HzT&refId=6KPLhCALssfi84iau8GsPg%3D%3D&trackingId=BDZbxNbeQTEKQoN%2F7SSeyw%3D%3D&trk=flagship3_search_srp_jobs
"Online Data Analyst (m,f,d) - Austria",TELUS Digital,Austria (Remote),,missing,15,5,"Full Professional Proficiency in German (candidate only has A2 level) | 2+ years residence in Austria | Familiarity with Austrian business, media, sport, news, social media and cultural affairs | Experience with maps, news, audio tasks, and relevance evaluation | Web-based data verification and comparison experience",Do not apply - you don't meet basic geographic/language requirements and this role would be a significant step backward in your ML engineering career.,https://www.linkedin.com/jobs/view/4227270372/?eBP=CwEAAAGdU_dpZmQGDiHW9OCKp7tWKAs2oPMr4BXwbZtt0LZiYnlCgHbz1rFqxpFi4GLbz-K5cwWBykGSVIwP362_PaDahH2o16DHtTkINDV76TdQq-pTivCDPfgLEC8BrPmWh2iWYLNA6TatUGRiASWrkb7h344YBOLZUjLQciJYjI0ycZCocIuQsonxU7Zn0wjbsBYOI3aZGBPM3xC_rpvLneunSWB3j-HKfFIYAhmK__BsQwBcL6mDjpMwCy4V48g4fi_BzHkKpzwaICj_ZNkt0l9t4FW5d4QPKkt-2DVq_0fS4AU8ac4ojhSihp9nmTZkB6tT9hUYDFzyzOXGTGMXRYTjm2KCnVWEkC1ieBrGgqfbbxJvXoPvqLd0fyK5khJFbwMrAdnbByK_NGEJDCCWlN645v9ps4UnkY42Lo4xLenpVFDkHrGe7-u21n2GR-_o4q4Gtv5GrcBpklb41iTJJ8bOLlQvsmuyuwzfghclpVQm0So&refId=6KPLhCALssfi84iau8GsPg%3D%3D&trackingId=RIHWe7%2B4Q5Nurg6IOhzG7A%3D%3D&trk=flagship3_search_srp_jobs
Product Manager,Philips Dictation | Speech Processing Solutions,"Vienna, Austria (Hybrid)",,missing,15,5,Product management experience | B2B SaaS experience | Healthcare/regulated environment experience | Product strategy and roadmap ownership | Stakeholder management across commercial teams | Go-to-market collaboration | Product requirements writing | Success metrics definition | Customer discovery and validation,"Do not apply - this is a career pivot requiring 4+ years of product management experience you don't have, and you'd be competing against experienced PMs.",https://www.linkedin.com/jobs/view/4380949567/?eBP=CwEAAAGdU_fptr52J4eEUeZERRR_G4_I80WIvuRtqAoHH8g9Fk0tLRX50cyKdEys6kz8g0TMAULSOKANCMjJnfa0oENWwHMRd2UYD0xFiZ8CVhH_iaQXAQ-LkPshDnQLVgyiuORb8S4XsihuiYDanibZgo7KR7tbygAMy3kBmHS7Qwrz9XUP3FG3EPlfKVVZZB1mxJsRKuIuuUZN-ZZktI699Ap_kBg1zvEJn8zsFeoo1FQWOWLYJH_8oxO1K6wlF9jqcVNmvFOlsEO8ZQUFx4vdxN4qGm5Y3EO1yl1UQB_K_d1rwhDeVcYEvvfbfuF3DZ66lSBHCPVEd7edXqMa0vd3DlMH7OTZP8hKpNhu8-r35t1nT5LdODyBvQ0sbwE2rdQj3rpCubtidgioimmEfMIYmm4vi3dtZsavk-KR8bIJko-nZC3GWDCnh-rxeyzZpcwTFssL9iSkYb8n6XUUX8-n-wVeo7ZYLovU48Fh&refId=law5p9DsWIi8GkGhcfp%2Bkg%3D%3D&trackingId=Z2R%2FqCm%2FoLOGsRWCpHIoFQ%3D%3D&trk=flagship3_search_srp_jobs
Product Engineer Customer Apps (m/w/d),SPAR ICS - Information & Communication Services,"Vienna, Vienna, Austria (Hybrid)",,missing,15,5,iOS/SwiftUI development | Android/Kotlin development | Native mobile app development | Mobile app deployment to app stores | Retail/e-commerce domain experience | German language skills | Mobile-specific CI/CD pipelines,"Do not apply - this role requires mobile app development expertise that you completely lack, and your research background doesn't transfer to consumer retail app development.",https://www.linkedin.com/jobs/view/4373359710/?eBP=CwEAAAGdU_gzixhUDIYNMYTJgqTZKTRHY_zGaHb5SKxbRvAs-Ozk77na1pw0AWGWvES5GbYe8XUdhZzRCpMxysTlJ5exrO2UU_FE7DkaIx8Iq72Zy_YkinJVqvtmqlhpDyqcOgoHR9SrJnYHaT7bDLrZLlUmtzd8ncvblCVg0NcXK0cntbzHAybsBmYTRlgFa66zLpg6RylsXScmcKPIsmyuhUyCtH1bKVj8_fGU4rfdrVX_N4LHi1jXhFg6fuSbfZ_0MEfz50UTtz9g7XkFKp1jjQ63o7zWrKfQ-JxPJRwLLVMcBAGzly-hsr7lyxLdoBoil304mYLq0Uc9puwBlc8_QsqMqSdLoDv2GqT9bAMfEa-OsZa8kR8TvMXUK4Eul_LnFGxa1UMTs7uMEV0BMbSvoYiPZpaaGZolPJTGPuAqIsS0-VdawKTHH7271eFrG1GR5LdEw3KJyOCyUW7y1m8HErw0KB2YBnaADJwMLUU&refId=RkpNxa%2B2EJ0w9CWaknvdww%3D%3D&trackingId=hUDhaL09Ggt2%2FoUhRV4GEA%3D%3D&trk=flagship3_search_srp_jobs
Data Validation Manager (w/m/d),Volksbank Wien,"Vienna, Vienna, Austria (On-site)",,missing,15,5,Banking/financial services experience | Risk management experience | BCBS#239/RDARR regulatory knowledge | Data governance expertise | German language proficiency | Power BI | JIRA/Confluence | Data validation/audit experience | Financial reporting systems,"Do not apply - this is a banking regulatory compliance role requiring domain expertise the candidate completely lacks, and would represent a major career pivot away from ML engineering.",https://www.linkedin.com/jobs/view/4315845297/?eBP=CwEAAAGdU_iHyu8C6RcDviG0q_J71Pp5qpY7eSnO1Cy62B1FXg2TgIpspC63b_LbTq_I1OEWTTRRg9lzvCPAweaYR7vZePuDxNtpBKoi2YyS9hbcQXMJiFrFZe2-xosR2aUKbDlUAITgHn5T8wkGJgIYJqo_JZjzRt-89TKel73WRlsabJ3Ou8PBKN35fo0-QZQhWixquyZqWfoMsbnIqfKW-CUDv1tar2MZV37x67vZHyOcKrxBBPV1Stt6Ro6wz3oGHkxQPSj3N7_ByT2j06QNfYy6ZEM0lbJPbCQE8EVCJGB9BqhUaMCWg12C6ZHgq-M2XQOoWvDI892v0CzNhPbanfsudBhm_qB_fbnxDfOQfLMg4qigcjf2gKCA8DN8T4oUZ4SNpVr-t39kk-pEmW3Et_VZK8CYtbmMBfj2y2qzxI1hoJhhVNOo25ptjk7Z6F4gtxrEhGBT5XRsnBs2EAN3mWZFoKCxxGc-qMPF-U0&refId=jqUgpShcE7ztEQdlv6gqeA%3D%3D&trackingId=Q%2B9AzwT%2BMET5AxyHrjJNEg%3D%3D&trk=flagship3_search_srp_jobs
Senior Scientist (all genders),Technische Universität Wien,"Vienna, Vienna, Austria (Hybrid)",,missing,15,5,PhD in Mathematics | Numerical analysis of wave phenomena | Boundary element methods | hp-Finite element methods | Fractional operators | Excellent German language skills | Grant funding acquisition experience | Service teaching in mathematics,Do not apply - this is a pure mathematics research position requiring completely different expertise than your ML/AI background.,https://www.linkedin.com/jobs/view/4391753069/?eBP=NOT_ELIGIBLE_FOR_CHARGING&refId=f657Xlc9GTEsua0VfW9CDg%3D%3D&trackingId=7UJjdECXtLaW%2B3DclzdEnw%3D%3D&trk=flagship3_search_srp_jobs
Werkstudent:in Support IT-Services & Project Office,SMATRICS,"Vienna, Austria (Hybrid)",,missing,15,5,Werkstudent status (currently enrolled student) | German language proficiency for deutschsprachigen Lebenslauf | Jira/Confluence experience | IT hardware management | Service management tools | Project management coordination | Internal IT support experience,"Do not apply - this is a part-time student IT support role paying €1,300/month that requires current enrollment and is completely mismatched for a senior ML engineer's career level and expertise.",https://www.linkedin.com/jobs/view/4397554977/?eBP=CwEAAAGdU_kBoo6UsQqlj1JNrP-oQqEXy7qU9NXdbEPYD7CUFAy3O6D5n5nVmXaknhG6aYtVtiFnLCeyPw4a1cZHsPtRLoSbdBtSiEWJD-4ZEH9gbW5B-AzR1XD9mjlfO4tPmuyaQcpJoSQzxqPYjtMSvRxrFLJGWtWp8WE9LA0QFEFFpuLim0De-Wb_gdkfHwTYUpbRqXrExim2bZuUAVQacJpaZUOs7U3IJcZsH9phOWWcHBfiJpy7QD3Us5ojE45Ng5sOXNLQmUzmshfqfkpaFokfWC3IEexXFnCrPEBtjVeCCptlLHBg1vi1P7QUlE9xdfJ9JhWkrzwmhAXFrYV_j7WH-olTihBu3xfTASn4GWW0zcGOmSgs8HpMISJXQBrpA6mMIE2mngsTOwnL5e566b5AVxyIrjKEYyr-EOBd-3SAOkgizx5sSLL2VVLkVxSM0ZevJ9ESYY75e7bxKhLpYKTceChC1HAZf2ot8UVToGCM0iY&refId=Y%2BSZX9JpvXFqJt4uRQHCxA%3D%3D&trackingId=VzNVLtSTwXPUbEdbHVg7lA%3D%3D&trk=flagship3_search_srp_jobs
Senior Consultant Penetration Testing (w/m/d),HiSolutions AG,"Vienna, Vienna, Austria (Remote)",,missing,15,5,Penetration testing experience | Web application security testing | Infrastructure penetration testing | Burp Suite or intercepting proxies | C2 frameworks like Cobalt Strike | Vulnerability scanners | Network security knowledge | Active Directory expertise | Database security | Firewall configuration | German language proficiency for reports | Cybersecurity certifications | Red teaming experience | Incident response knowledge,Do not apply - this is a complete career pivot from ML research to cybersecurity with zero relevant experience for a senior-level security role.,https://www.linkedin.com/jobs/view/4338722614/?eBP=CwEAAAGdU_kBoq4GQZ1vuEQT8qlP0hyBTyxN84tdSYP-SlBmm75Wpc2S4JuzF_w0wLuTTpn58NF0ow63lkHbnULF1tuj3QQ__NZTPF9muqq15CeYtpEEYwTd9ofdoOtdX3ZlogeKKtyXAFWfaGNIa-AzGMK0sffxAcFP0SeScuHqp5z0L8QdEz5fkIJV8cC1UQcRqBWfbE8pZK1-zDhLZrPbEcQpfryi4bWo0RezHHpVKTmV-bIAZ8jQeyrG3jg00jxtCBtX542eokPxm3WyYFPITGXf7FjfhgIwaKpASkCjtPCU406H55zRo_8at4kQuuum3xAy4H7STkRySxMffRX9NqZAOMlN07P-uxnL0IaWqli1VjzrRnVA_fSDH6a4V3mtqFRdy4ld6XKY7oGZEtUmjIxK_3k3g3H8M1iaxyzAqcZIjMvnsDtxHH4WZyUA-5cU_PSFoNfrcsVscWME7rIlPdfwygwvUpITJrwilLI59g&refId=Y%2BSZX9JpvXFqJt4uRQHCxA%3D%3D&trackingId=jphk4%2FDIeRSNSQdimtfPOA%3D%3D&trk=flagship3_search_srp_jobs
