Title,Company,Location,Salary,Salary Type,Fit Score,Response Probability,Missing Skills,Verdict,URL
--- ANNUAL SALARY (12 jobs) ---
Machine Learning Engineer,marbl,"Vienna, Vienna, Austria (On-site)","€3,819/yr - €3,819/yr",annual,75,65,Trading or financial markets experience | Electricity markets or power systems knowledge | Linear programming and stochastic optimization | Meteorological/weather data experience | Production forecasting models for trading | Backtesting frameworks | Real-time trading constraints,"Apply - your strong ML credentials, Vienna location, and relevant technical skills outweigh the domain gap for a small company willing to train.",https://www.linkedin.com/jobs/view/4397044487/?eBP=NOT_ELIGIBLE_FOR_CHARGING&refId=PiNN3akXoeM8AeqfW0Q3FQ%3D%3D&trackingId=yLyt7PuHhvrxCpOP1x037A%3D%3D&trk=flagship3_search_srp_jobs
Data Engineer (Barcelona Relocation),Capitole,European Union (Remote),🎓 €1200 per year training budget and continuous learning opportunities.,annual,25,15,Azure Data Factory | Databricks & Delta Lake | Apache Airflow | PySpark | Lakehouse architecture | Medallion architecture | Azure cloud platform | Data warehousing | Batch/streaming pipelines | DataOps practices | Performance optimization for data workloads,Should not apply - this is a mismatch between ML research engineering and production data engineering requiring specific Azure/Databricks expertise.,https://www.linkedin.com/jobs/view/4395050927/?eBP=CwEAAAGdU_NKtHhobzhdR726oEQVW-2-QiiB1z50Rzs2YnvcYbO3GKjFK9Rvolie413FbBegqwRR3Xq2Al1UHTqiBQJTTcDaPUt-Son_ReyER_zUXAfw0B-KaJxDzHwi10IdX05I0es5KL3vr5XsPFp5sMD252YWhVovcU8qWc6sstRfRKUiSFpLs0Xzn6vHycc8ltW8YybD5X-OwHYX3duWloABArBKIzOwzA4Tn_wh45yZZdizY6gPhV2Op671z4Q9ptaX6VJ9cF7iO-ulxC3uiHZLWM5M-hhXwNEPv4zsxQw9h2y39kq1lQP5moNMWwbIks8MGhsebqT-UhZtDv2_bhM-Pygn-a7BW46ir3NfzzSLDgkTbKe4BQ4u4uWx8_h475UzOfQY-WWz0KmIAIWeP4nGbl1M6u4rrgE2MU6djE2UHZDVyxiNMGfPOmCXVoinFfiBtmHVsdZjmQHMVPxxJS9C5WjXqrry&refId=hcgJroqeW4FcQtTBhln28w%3D%3D&trackingId=PdMOWHaip5zeUDBg8p0wGA%3D%3D&trk=flagship3_search_srp_jobs
System Engineer,Set2Recruit,European Union (Remote),"Salary: €80,000 - €90,000 (Tax Free + Great Benefits)",annual,25,15,"Modern C++ (C++17+) | CI/CD tools (Jenkins, GitLab CI, GitHub Actions) | Testing frameworks (Google Test, Catch2) | Kubernetes orchestration | Embedded Linux (Yocto) | High-performance/real-time systems | Distributed systems and networking | Performance profiling and optimization","Should not apply - this is a systems/infrastructure engineering role requiring C++ expertise, while candidate is an ML researcher with primarily Python background.",https://www.linkedin.com/jobs/view/4396472310/?eBP=CwEAAAGdU_OGjL6vnJLUvZLjKIB_zB7S9eCHFxl4phPZrLtkqarhdIUQvoEiUxP982zylW_YZfqNhtxBfpdDWvOqgkI-ak0lSnI9AaOQ11qT0sXj7svACWU15lOGvy_7WKIpgFbb0WMhyInEKkxTrKQerJa9YQBuwcy0eqNUO_W238kjtLfEbSflMTX_eSUoRdIDM2plr_M04O16dKGl4j3fI1eslqU_sYxr6RnRiVlYT5hw10yzXbFwAxAXMX5NwM5cilRy5lEJmmTZco6YDbEEaUpCpDbo675dxUhOXXbhI6xj0VV-iY_4a0KW-MzaohwJMCzpufGKVpHfDRHYtwUYem7rLhcxN6JoTKigrzZErsKppzZFIxP0Swna5L8QDVuqEf5MKJ1MjM4XBWcZo2LZDOyi_tAUuoNGRoZSoGAIpxFSV5UkfcXtBOwXttLc0t2Zo1M8nT5BcL_RXCRjy3sZMQeKzftVfwfr&refId=DM48ZqdnngiwxTT45GFaqA%3D%3D&trackingId=H%2FY4hznNA5U5mqhLsoP5Mg%3D%3D&trk=flagship3_search_srp_jobs
Senior Full-Stack Engineer (Applied AI),Sagan Recruitment,European Union (Remote),Salary Range: 3200 – 5000 EUR/month,annual,25,15,TypeScript | Node.js | React | GraphQL APIs | Postgres | Frontend development | Full-stack web applications | LLM integration patterns | Commercial software development,Should not apply - this is fundamentally a senior full-stack web developer role requiring extensive TypeScript/React experience that the candidate completely lacks.,https://www.linkedin.com/jobs/view/4382429570/?eBP=CwEAAAGdU_OGjM3EdiLuzRYqCgWSlxU5A6BDYuavGAiwcgvDA0ZFs-QjHbXKczBA4RB8yDPcPhNolFJcS5DlW0Q6DjxRnlECbbfJRQCyd9WnKms4G_Z1I9UFdf3y_1dFU74qHNIdko5dA5W528mZ966Lx9rDtBrPMslwhNOV880oWpX7oiDUOO1o8o2_Xp65vOhhuYEPZpffxCEA5B81B-RDsT7FNfvandEuDeD8VagS5DOoZ5mMbbbPQ-8g2iGbJrlV-m2om_oemHS7B2V-aGXABCX1oMDyCo4opxIuCMcyYKYvaX-edjSgTjlHSPInpehE-KxLBvqUZJmW9M7PD0CZzL2wXYvHtS0afF0LNve_YBO32EbWhQgSfQxs_uW-WpmDgohL80QqF_t_WYeLFOMAjHhMhureWTYjlrBXNidVouFw0dQVvMD4VfpxZrxSSsIeBIvMU-2NUw5IyXuS4uBdyGACrmWROWrrONOTqretKq2g&refId=DM48ZqdnngiwxTT45GFaqA%3D%3D&trackingId=48MvRk%2BwYbhklUXxb%2F7skA%3D%3D&trk=flagship3_search_srp_jobs
Senior Backend Engineer - Engineering Operations,Camunda,"Vienna, Austria (Remote)","Health & Wellbeing: Access locally tailored healthcare, Modern Health for global mental wellbeing, and our Live Well Lifestyle Spending Account (LSA), a flexible, global benefit that puts you in control of your whole life, not just work, from: staying active, to caring for family, exploring personal passions, meaningful experiences, and investing in your financial wellbeing. The Live Well program launches in 2026 and scales to €1,000 annually from 2027.",annual,25,15,Java development experience | CI/CD tools like GitHub Actions and Maven | Backend/fullstack engineering in production systems | Release management and dependency management | CVE management | DevOps toolchain beyond Docker | Business process automation systems | Enterprise software development,"Should not apply - this role requires a senior backend engineer with Java and enterprise DevOps experience, while the candidate is a research ML engineer with fundamentally different skill sets.",https://www.linkedin.com/jobs/view/4378111909/?eBP=CwEAAAGdU_P-rmI63edMraVDcZZ6nzqdBYTkqvEKEYAyrCEl0yO98RcY_ocuhNE-8Ct7huIFQH3c01P-_v1yCbCQbSmT5vMPgBfd5IWL3N0u-49wQTUMF1Udqh5quYsKFA6jMrnmVocUS0QW-yMkda9pFAxvCMDKOvMpSqnFX_oetSxNyKSdNwzWyu42WOkPJx-xxT94OCbjLQpO5JiyYh_mDDo8m6FtDnugnaMIb_iSMbqkwpQaHYqZnWMBCEdne-j26KysC6JmDMOZTErpkQe6_hAVmehEwnbjQxcgquC-FLS1UVY_GgW30EOPd7UHkqMYZrebcoeJxRf3qv7pfUJAFETxIbJGboE_qDclDUGuTyoooDNpijuqy0wJW6-Bkdna609R6cLTEy6s50XWcE7EGgeKmHgQBMiLO8hR57G96HI2GGOSPhtvboo0bmVhswtD8Ppaw7tMV4zVAMR1peJYF4w0wNOYvPQcrOyKNjtmK9n34rPa3ia8JS0EhrNkXjg71-SwIg&refId=oQYP%2Bp3ys37h4BFQTIKLHA%3D%3D&trackingId=vAAw0s5DzXAvVdHaMr9F%2Fw%3D%3D&trk=flagship3_search_srp_jobs
Research Development Consultant,Work Consulting,European Union (Remote),"€3,000 – €8,000 per month( Part-Time/Temporary Engagement）",annual,25,15,PhD degree specifically required | Post-PhD experience (candidate has M.Tech + research experience but not PhD + post-PhD) | Cross-functional commercial collaboration | Patent development experience | Technology transfer strategies | Biomedical/materials/energy domain expertise,"Should not apply - the PhD requirement is explicit and non-negotiable, and 58% of applicants already have PhDs making this highly competitive for a non-PhD candidate.",https://www.linkedin.com/jobs/view/4397197861/?eBP=BUDGET_EXHAUSTED_JOB&refId=mUDzFaoeWVfVGrf8pW6PZw%3D%3D&trackingId=gP38giJ0Hs6xmDCEBWZzWA%3D%3D&trk=flagship3_search_srp_jobs
Senior Data Engineer,Signify Technology,European Union (Remote),Rate:$500–$550 per day,annual,25,15,Scala programming | Apache Spark | AWS cloud platform | GCP to AWS migration experience | Airflow orchestration | Data engineering seniority | Kubernetes,Should not apply - this is a senior data engineering role requiring specific enterprise technologies (Scala/Spark/AWS) that the candidate has no demonstrated experience with.,https://www.linkedin.com/jobs/view/4394528908/?eBP=CwEAAAGdU_o3Bk5OPIEfwLYeaHBHbhOFIQ7-b_grWHiEGvq0VPhD5XlgVJdgwUYzJRsYeUvk-1z4EE32nIywLOGQRwJJ1g8jKNNcv4iTpjfEyn9mZDXv-lctXJvDy5vaKy8-LTgMeYNLypZfkGjOmHe9oR14a3bSOOi6VFTfaD8F5qJ3OGhxy_IxCCMoOeEdG35MLUz-qitd6vms7JnIelA5W26rNshe3GiO5m3O4j14u8dbE9eCphGZen9VlsZ-yfuLrAeVOkzNef2wFJrVnwx-Y_O1NXIOwW0oDU5bjkBjR4OERHFRtkoboGdFXi6042dz_xc0ZPm59kg-dmZUUy5Q5uiynH4ifzded0QH3Sj7vA81xJzhsvVg1J3pn72UUkmr1CgngqA82b4XMMocdrpzicbnIBOnIAsQjjEOyDsqdAC5L6cJIUfK6dnOiHAMIE_-IOnODarNsVHYK-WgOJyHkiRrNM8In1BImfijwdVDL7C1&refId=TD3UY9P08fsaRf5QhtLv9A%3D%3D&trackingId=OTiEcdLaTD8J%2F%2FQm7i5ufg%3D%3D&trk=flagship3_search_srp_jobs
SAS Consultant,Archer Recruitment,European Union (Remote),Up to €500- €550 per day,annual,15,5,SAS expertise | Actuarial background | Financial services experience | SAS to Python migration experience,"Do not apply - this requires deep SAS expertise and actuarial background that you completely lack, making you fundamentally unqualified despite your strong Python skills.",https://www.linkedin.com/jobs/view/4393299904/?eBP=CwEAAAGdU_RJZprXU4IQn5Nxy6mnPCrikYhdfOXIjvqVPCJfmv-PuMwcaIVc3bJVm9WMPfIPuscdaRbtlUz2CAt-GdCkNuVcaRVUNAFH2gQtOeRxKX9r8uj5AMIyFcqKvivtnUJH1DT9UJOs3votJ10nNrhBXi1KlT4mRtrBN-BVuGG0JupC4EJ6cNeu_Ph187fe-CSF1P8ycLcgUBqisH7pc-bxMs9IcPE5lT7I4dzIhelefWYi-oqlFDld-K1HPEVqJEBOYrgMa3SFHhC2irKsZjlw4XabQGeZvYJdQJaD16JI43Nh_zyR1cwliDHTt6J-W9XD3sC3a4mFQctK0HHTktomwMOT2OUHLyCVgzLK9ajHZBqP5RYOKRJR3As6sUVYZLl9cYI8yZjWEUoPNK6rszUnTYUrzlTvIDm9hTWwLgA3E0tGRjSEuDjRBMgzTnzN7PK-1NzCu7u8AjSnm1m6ZBGn4fDmNO_pwm1vjPPR6c0s&refId=HGJ8MFn5eLlVoxUKQrqIOw%3D%3D&trackingId=Pb%2Fhk6b9I3Z9%2BWjiGUUhVw%3D%3D&trk=flagship3_search_srp_jobs
Research Manager,European Space Policy Institute (ESPI),"Vienna, Vienna, Austria (On-site)","The position is full-time (40 hours/week) with flexible working conditions. The advertised salary is in the range of € 80,000 – € 85,000 gross per year (paid 14 times a year). Given ESPI’s status as a Quasi International Organisation (QIO) since July 2025, the salary of ESPI employees is exempt from tax.",annual,15,5,Space sector knowledge and experience | 12+ years work experience (has ~4 years) | Economics/Political Science/Law background | Policy analysis experience | Team leadership and management | Budget and contract management | Space industry understanding | Strategic planning experience | Think tank or consultancy experience,Do not apply - this is a senior space policy management role requiring completely different domain expertise and 3x more experience than candidate possesses.,https://www.linkedin.com/jobs/view/4396989566/?eBP=NOT_ELIGIBLE_FOR_CHARGING&refId=uMAArkmjU88nIRUSpPxcgw%3D%3D&trackingId=oCQDx8HLEa%2BdB0ezvmuRgQ%3D%3D&trk=flagship3_search_srp_jobs
Finance Analyst - Austria and Europe,LUSH,"Vienna, Vienna, Austria (Hybrid)","Compensation: €1,975 - €2,678 / month",annual,15,5,Finance background/qualification | German language skills | Retail/commercial finance experience | Sales reporting experience | Till system management | Stock management processes | Budgeting and forecasting | FP&A experience | Business intelligence systems,Do not apply - this is a complete career pivot from ML engineering to retail finance requiring domain expertise and German fluency you don't possess.,https://www.linkedin.com/jobs/view/4395268839/?eBP=NOT_ELIGIBLE_FOR_CHARGING&refId=k3cvThPbXqcOAHJjL1jqUw%3D%3D&trackingId=zs6QkVHR9KisnFOAOAgj%2Bw%3D%3D&trk=flagship3_search_srp_jobs
Lead Platform Engineer,SQUER,"Vienna, Austria (Hybrid)","At SQUER, we understand that career growth and learning are key to the success of our employees and our company. That's why we offer a range of opportunities for our team to constantly build their knowledge and skills. One of the ways we support our team's learning is through a freely available further training budget of €5,000 per year. This allows our employees to invest in their own education, gain new insights that can be applied to their work, and allow them to bring fresh ideas back to SQUER.",annual,15,5,Kubernetes/OpenShift cluster management | GitOps with ArgoCD/Flux | Infrastructure as Code (Terraform/Pulumi/Crossplane) | CI/CD pipeline design | Multi-cloud platforms (AWS/GCP/Azure) | Supply-chain security | German fluency | Platform engineering experience | Enterprise consulting experience | Technical leadership of engineering teams,Do not apply - this is a senior platform engineering role requiring enterprise infrastructure expertise that doesn't align with your ML research background.,https://www.linkedin.com/jobs/view/4392505781/?eBP=CwEAAAGdU_8Of-9fDBkwTA8kpdi-MJdaDzxs6LYJvYMUhkd-FoRusAOtBWuZEddgtNnI4dhRtgLQ_feFsCYcsMw6GMusiMW40mzrHL3mtY1GBnWt7o7WYbrrGnQ91HZ3hfsytUb_0bcSmmcaFUklbgJoXDiYJ2ZzXgxSCJ5QbpdWOzCeNwT4VMR6FAkxdC8vBCB3i-st4nN8wJUuTvhmhM00im_b7qUDI_y4oOzRIFzwz54H0YOoTJkmUkaR54t3vSb9312WENtltFIbGGzXfNg4C4Ehf59YQKo6tZa1tn6IVzjvj7ebXHZj3r5cYPxHNgNVd5OsoB7AuTvksaCdZN6g-F1T0q7PlCRhvDH7IOR6jYj-z8jj66NZfovkkzc1u0AX53i7hKBZwQb0v7fSW5dHu-3LVSz5_QBf-DV8zwqNpjGRyU4RFEFOqoVNTcrSeDzvJgA0X5HFGQ&refId=eEpyFSGsqxLvmD29oOu3Ag%3D%3D&trackingId=1ZncoETxaid987%2FcCCAPxw%3D%3D&trk=flagship3_search_srp_jobs
Lead Front-End Developer (Angular),Qualysoft,"Vienna, Vienna, Austria (Hybrid)",€520 - €560 a day,annual,5,0,"Angular 18+ development | TypeScript | Frontend testing (Jasmine, Karma) | Angular Web Components | Responsive Web Design | Accessibility standards | German language proficiency | Frontend leadership experience | Security clearance eligibility",Do not apply - this is a senior frontend developer role requiring Angular expertise while your background is entirely in ML research engineering.,https://www.linkedin.com/jobs/view/4389752428/?eBP=NOT_ELIGIBLE_FOR_CHARGING&refId=oQYP%2Bp3ys37h4BFQTIKLHA%3D%3D&trackingId=AY23rraV1R%2B6u2Zh1OMg%2BQ%3D%3D&trk=flagship3_search_srp_jobs

--- HOURLY RATE (92 jobs) ---
(Master’s/PhD) Academic Content Contributor – Engineering | $60/hr Remote,Crossing Hurdles,EMEA (Remote),(Master’s/PhD) Academic Content Contributor – Engineering | $60/hr Remote,hourly,85,75,CAD software experience | Traditional engineering disciplines focus | Manufacturing or design engineering background,"Apply - strong technical writing skills, advanced degree, and research experience make you competitive despite domain mismatch.",https://www.linkedin.com/jobs/view/4392883684/?eBP=NOT_ELIGIBLE_FOR_CHARGING&refId=mUDzFaoeWVfVGrf8pW6PZw%3D%3D&trackingId=6crbT3P88bF%2Bl3sVw9W7ug%3D%3D&trk=flagship3_search_srp_jobs
Computer Science Expert with Python Experience - AI Projects on Mindrift,Mindrift,Austria (Remote),"On this project, contributors can earn up to $50 per hour equivalent, depending on their level and pace of contribution.",hourly,85,75,"Explicit Computer Science degree | Professional certifications (CMME, SAS, CAP) | Direct experience designing CS problems for evaluation | Structured scoring criteria application experience",Apply immediately - your technical skills perfectly match their Python requirements and your research background at IST Austria gives you both location advantage and the analytical rigor they need.,https://www.linkedin.com/jobs/view/4393550694/?eBP=NOT_ELIGIBLE_FOR_CHARGING&refId=KhkQm0TyAfBPvrM0IGiu%2BQ%3D%3D&trackingId=9NJ86etfCYYsmxPuFyS2oQ%3D%3D&trk=flagship3_search_srp_jobs
Statistical Specialist | Remote,Crossing Hurdles,EMEA (Remote),$62/hr - $120/hr,hourly,75,65,"R, SAS, or SPSS proficiency | Traditional statistical consulting experience | Business-focused statistical methodology evaluation | Dashboard creation tools | Data privacy and ethical AI formal training | Client-facing statistical consulting","Apply - your strong Python and data analysis skills translate well, though you'll need to demonstrate statistical consulting mindset beyond your research background.",https://www.linkedin.com/jobs/view/4395025537/?eBP=NOT_ELIGIBLE_FOR_CHARGING&refId=W%2BWWHmxCCKtxuYWCiznb9g%3D%3D&trackingId=d8pLbz%2FE5d9XQ6Nw6SSr9Q%3D%3D&trk=flagship3_search_srp_jobs
Senior ML Engineer (Python),Proxify,EMEA (Remote),€55/hr - €99/hr,hourly,75,60,"Cloud platforms (AWS, GCP, Azure) | Kubeflow and Airflow experience | Database and data warehouse experience | CI/CD for ML pipelines | Model monitoring in production | Classification and recommendation models for business problems | R or Java programming languages","Yes, apply - strong Python and ML fundamentals with production experience, though highlight any cloud/database work and emphasize business applications of your technical skills.",https://www.linkedin.com/jobs/view/4338878619/?eBP=NOT_ELIGIBLE_FOR_CHARGING&refId=JOD7%2Bx8rDyBzz%2BJtqmk03Q%3D%3D&trackingId=3cf%2FhZwgxvpmTmBWKV7LPA%3D%3D&trk=flagship3_search_srp_jobs
Data Analyst | Remote,Crossing Hurdles,EMEA (Remote),$62/hr - $120/hr,hourly,75,65,R programming language | SAS or SPSS experience | Business intelligence dashboard creation | Data storytelling for business audiences | Statistical consulting for non-research contexts,"Apply - your strong Python and statistical analysis background compensates for missing R/SAS experience, and the role's AI focus aligns well with your expertise.",https://www.linkedin.com/jobs/view/4395020823/?eBP=NOT_ELIGIBLE_FOR_CHARGING&refId=JOD7%2Bx8rDyBzz%2BJtqmk03Q%3D%3D&trackingId=E%2Ft5wkIMxl0EF5ujQgGD8g%3D%3D&trk=flagship3_search_srp_jobs
"University Assistant Predoctoral, Computer Science",University of Vienna,"Innere Stadt, Vienna, Austria",$85/hr - $85/hr,hourly,75,45,"German language proficiency (requires excellent German) | Multimedia systems and digital media technologies focus | Misinformation detection experience | Java, C, C++, JavaScript programming | Web-based systems and databases | Formal Computer Science education | Teaching experience in CS courses","They should apply if they can demonstrate German proficiency, as their strong AI/ML research background and publication record could compensate for the multimedia systems gap.",https://www.linkedin.com/jobs/view/4392041973/?eBP=NOT_ELIGIBLE_FOR_CHARGING&refId=lsGwFFmDjcc8h9EilnO9Dg%3D%3D&trackingId=4U5e3mnvmFWacTxAmnbmtw%3D%3D&trk=flagship3_search_srp_jobs
Freelance Machine Learning Engineer,Mindrift,Austria (Remote),"On this project, contributors can earn up to $58 per hour equivalent, depending on their level and pace of contribution.",hourly,75,70,"5+ years experience (has 4+) | Expert SQL and database operations | GenAI technologies (LLMs, RAG, prompt engineering, vector databases) | LangChain framework experience | MLOps practices beyond basic deployment","Apply - your strong Python/ML foundation, Austria location, publications, and research experience make you a solid candidate despite missing some modern AI stack requirements.",https://www.linkedin.com/jobs/view/4393214511/?eBP=NOT_ELIGIBLE_FOR_CHARGING&refId=law5p9DsWIi8GkGhcfp%2Bkg%3D%3D&trackingId=YUydddSMreEOLJZZ5kx2rA%3D%3D&trk=flagship3_search_srp_jobs
Data Management Specialist | Remote,Crossing Hurdles,EMEA (Remote),$62/hr - $120/hr,hourly,75,60,R programming | SAS or SPSS experience | Business reporting and dashboards | Data storytelling for non-technical audiences | Explicit statistical consulting experience | Data privacy and ethical AI knowledge,"Apply with caution - you're technically strong but may be overqualified, and you'll need to emphasize statistical consulting aspects over ML engineering.",https://www.linkedin.com/jobs/view/4395029567/?eBP=NOT_ELIGIBLE_FOR_CHARGING&refId=H04ZsOuPSFxvijbVF6L4KA%3D%3D&trackingId=rvS9uXXBliYyVq62GBGvqQ%3D%3D&trk=flagship3_search_srp_jobs
Biology & Python Expert - Freelance AI Trainer,Mindrift,Austria (Remote),"On this project, contributors can earn up to $45 per hour equivalent, depending on their level and pace of contribution.",hourly,75,70,Formal Biology degree (has Aerospace Engineering) | BioPython library experience | Bioinformatics tools and methods | Systems biology experience | Molecular modeling experience | Specific computational biology problem design experience,You should apply as your strong Python/data analysis skills and research experience outweigh the biology degree gap for this project-based role.,https://www.linkedin.com/jobs/view/4392067972/?eBP=NOT_ELIGIBLE_FOR_CHARGING&refId=k3cvThPbXqcOAHJjL1jqUw%3D%3D&trackingId=fbrq4d3gGI%2F7tBdcARN9lA%3D%3D&trk=flagship3_search_srp_jobs
Data Engineer,Remobi,European Union (Remote),€55/hr - €99/hr,hourly,75,65,"Snowflake experience | AWS services (S3, Lambda, API Gateway) | AWS CDK | Financial/pricing calculation systems | SAP data integration experience | Proven backend architecture at scale","Apply - your FastAPI experience and proven ability to refactor complex data pipelines gives you a solid foundation, though you'll need to emphasize transferable enterprise data skills.",https://www.linkedin.com/jobs/view/4396457256/?eBP=CwEAAAGdU_y6ZcjVH8gGkQwVlMnihCcVebGc2zpcr1h2TQDjV9drHX8lX-zceBxGUmJWtl_0DiQL4LzkmeTP1J9dAw4YIf6LdnlBDvR5QnkW9xiUAHIKFwbjNp6dAotbRhc5BcFW1FKky8rFqGjiXi6IoOU-ngWuj_skFmSYp1ItQ2zLsHWjISmqYp9EHweJwfx_vqyi2UxThhUl__xweHA4YmRLb7qxF3dN7j9dqpenet_bYhey8Tlc8atpMcd1Vl8cV89au_FuUSKl5ii83_nRKV5NVvM4oICu8mJKoZ0yEoKGutkD_ggnVP_yd66dPSbtvgHbBij1rpV9go7Vk3XiD3Mg3T4PvU_BlAu5oV0NHmy9i6HjRsTYRsLHxX8zsN11O5I7hy-yptvtwXmnBDZQ1qfMZzjX7SqLdC2cqQyY1E6WiqChjVo991r_C4jOh2B24rkuHzpHmzCXUvu-rc9PCCtnIWF49A&refId=fKf58i7TAaDhZKoQTg6pgQ%3D%3D&trackingId=xzxEQbMpomhbn2F2hwm3gw%3D%3D&trk=flagship3_search_srp_jobs
Python Developer,micro1,EMEA (Remote),$100/hr - $100/hr,hourly,75,65,Pure software development focus (heavy research background) | Traditional web application development | Cloud platforms experience | Deployment automation | Open-source contributions,"Yes, apply - your Python and AI expertise strongly match their needs, though you'll need to emphasize your software engineering over pure research experience.",https://www.linkedin.com/jobs/view/4395705162/?eBP=NOT_ELIGIBLE_FOR_CHARGING&refId=1s1TRVB7%2BmTIeUUT1g4QVQ%3D%3D&trackingId=6BvjeBDEbwRAJ5aku%2BsPQg%3D%3D&trk=flagship3_search_srp_jobs
Software Developer | Remote,Crossing Hurdles,European Union (Remote),$150/hr - $150/hr,hourly,65,25,JavaScript/ReactJS experience | C/C++ development | Java programming | Rust programming | Go programming | Full-stack web development | Production-grade application development at top-tier product companies | Enterprise software development experience,"Apply cautiously - while the analytical skills transfer well, the heavy research background and missing enterprise software languages make this a stretch against 1000+ applicants with more direct experience.",https://www.linkedin.com/jobs/view/4369848108/?eBP=CwEAAAGdU_K0PbUCM_mNPpwW0semwccTT8Z84cYE1AVMvWC6Fequ77ZbH-EM5Qtym8ga6j_bhCJsYHPTBlt1zNa4-hAENy2R2jZkW_avYuAucK4CubTWBfas4a7g3m9xwbB1sGXM1kAibBKyYqnSfkLE7ulrags2jZWiHQAAUXdoLVyQRS9VT3XO0a_sHwIoo_AFtaQwa2RsNMg1ThbxLSKy8GmAovzKim2_qJjq80jmA_WVBrUJnlcbqbLN-YMwX5lDFIiH9VK0WcDPC1w63Ca1hJf8NdwIvURD87WnPJdYFSLduua2k8ZACSedq4y9fEBPUqEHWEYFCDIIBX-bWr8tjqp-PlRnAsQ7m44gBtInL4fC0WjaO_s4f5oAJkVO1BvHFzifgJ58fplCdDxJTC_JQk8dUTK5su7FJOMbvf5-AnZO5fCuba4JyNTVFnK6ipqifZuYsFFy0powBiNVAk4XkE25NaSPMnfg9tb8iUCD57AZclYXDA-tQYepLRGSVDwX&refId=nqFcEen7o2swW1OErM9KdQ%3D%3D&trackingId=8lHIsS2sjz9lldasGJBmEw%3D%3D&trk=flagship3_search_srp_jobs
AI Engineer - EU Remote - up to €130k,Oliver Bernard,European Union (Remote),€55/hr - €99/hr,hourly,65,25,"LLM experience (GPT, Claude, etc.) | RAG systems | Agent frameworks (LangChain) | Vector databases | Tool use and function calling | Conversational AI | Production LLM deployment","They should apply as their technical foundation is solid, but they're competing against 239 applicants with likely more direct LLM experience.",https://www.linkedin.com/jobs/view/4395635949/?eBP=CwEAAAGdU_K0PtetIuAX81Gi7jo4c8i1ZxGZzi-7l9gqEOZVEuiPsRKTKibU4GzV_xzKYF0Py4IEufeblyu7ECX_h2LnpKxC3_cKMPK46cZ3CfNHYm017MenHhdoVjczlWjAAdQfY1cuwSvOuHtJWjvQq--fnJHwybyRSS6mmWiPP8sHgIDg2XLyjTFr4OHgVq_RlC6RT9amXB48O4Dpq3UgjktzpCB-2Q1jheXttSpComx6g5H3C5-0PKnFJgCWIH-1qkloTXHTb79aQKB1I55I9K0ar8Wll3hK4Kj7_Lk5r1e-1ywoKkVsmq9Nxu_yHD49Q3pqJNHodqij13uoeABKCuRtdYqkBttv5RyGaDlxKCXoV1xj5tZeyhT3_QSE8ce61JMGOv0OrcyBQ_yXZ_3WsGOKc4xi6c7TsA0otCzlLzOdpNjxGcJH2fg7NJRSZmkHXMAxBXLXKMQyXQ4YJfKIodPBjGFjnpEe4EJXRU9yB13scQFIcF2gAbETv3GaY0ZBIv0&refId=nqFcEen7o2swW1OErM9KdQ%3D%3D&trackingId=MxHt6rVWfq68KD3dEfLGdw%3D%3D&trk=flagship3_search_srp_jobs
Freelance Data Science Engineer (Python & SQL),Mindrift,Austria (Remote),"On this project, contributors can earn up to $58 per hour equivalent, depending on their level and pace of contribution.",hourly,65,70,"SQL database operations expertise (only mentions LeetCode SQL 50) | GenAI technologies (LLMs, RAG, prompt engineering, vector databases) | Business-focused data science across industries like finance, telecom, healthcare | 5+ years hands-on data science experience (has 4+ years) | Statsmodels, Matplotlib, Seaborn libraries | Big data processing at scale beyond 11TB research datasets","Should apply as the technical foundation is strong and location/language requirements are met, but expect competition from candidates with more direct business data science experience.",https://www.linkedin.com/jobs/view/4393514345/?eBP=NOT_ELIGIBLE_FOR_CHARGING&refId=lG5A2iKhnvhuL%2FhB8XOHvA%3D%3D&trackingId=RyOPr1Z%2FgH3CQHbzULD61A%3D%3D&trk=flagship3_search_srp_jobs
Data Engineer (AI/ML),micro1,EMEA (Remote),€55/hr - €99/hr,hourly,65,45,ETL/ELT pipeline design experience | Relational database management (PostgreSQL/MySQL) | Data schemas and storage system optimization | Data validation and monitoring workflows | Production data engineering at scale | LLM-related data workflows,"Apply with caution - your research experience shows relevant foundations, but you'll need to clearly translate your academic data work into production data engineering terms that match their infrastructure needs.",https://www.linkedin.com/jobs/view/4396573840/?eBP=NOT_ELIGIBLE_FOR_CHARGING&refId=hcgJroqeW4FcQtTBhln28w%3D%3D&trackingId=lNNVa38yvrEWgr5R%2B5mtKw%3D%3D&trk=flagship3_search_srp_jobs
